"No.","Time","AbsTime","Source","Destination","Protocol","Length","Info"
"2","0.025352894","12:26:36.444117480","192.168.57.30","192.168.57.20","TCP","76","56913  >  7710 [PSH, ACK] Seq=1 Ack=1 Win=8326 Len=10 TSval=453538 TSecr=1542824235"
"9","0.125408324","12:26:36.544172910","192.168.57.30","192.168.57.20","TCP","76","56913  >  7710 [PSH, ACK] Seq=11 Ack=121 Win=8326 Len=10 TSval=453547 TSecr=1542824343"
"18","0.225342722","12:26:36.644107308","192.168.57.30","192.168.57.20","TCP","76","56913  >  7710 [PSH, ACK] Seq=21 Ack=238 Win=8326 Len=10 TSval=453556 TSecr=1542824436"
"25","0.325332319","12:26:36.744096905","192.168.57.30","192.168.57.20","TCP","76","56913  >  7710 [PSH, ACK] Seq=31 Ack=359 Win=8326 Len=10 TSval=453566 TSecr=1542824537"
"32","0.425284123","12:26:36.844048709","192.168.57.30","192.168.57.20","TCP","76","56913  >  7710 [PSH, ACK] Seq=41 Ack=485 Win=8326 Len=10 TSval=453575 TSecr=1542824642"
"39","0.525306539","12:26:36.944071125","192.168.57.30","192.168.57.20","TCP","76","56913  >  7710 [PSH, ACK] Seq=51 Ack=606 Win=8326 Len=10 TSval=453584 TSecr=1542824738"
"50","0.625333817","12:26:37.044098403","192.168.57.30","192.168.57.20","TCP","76","56913  >  7710 [PSH, ACK] Seq=71 Ack=1189 Win=8326 Len=10 TSval=453593 TSecr=1542824842"
"57","0.725316707","12:26:37.144081293","192.168.57.30","192.168.57.20","TCP","76","56913  >  7710 [PSH, ACK] Seq=81 Ack=1310 Win=8326 Len=10 TSval=453602 TSecr=1542824940"
"64","0.825345640","12:26:37.244110226","192.168.57.30","192.168.57.20","TCP","76","56913  >  7710 [PSH, ACK] Seq=91 Ack=1435 Win=8326 Len=10 TSval=453611 TSecr=1542825041"
"73","0.925437767","12:26:37.344202353","192.168.57.30","192.168.57.20","TCP","76","56913  >  7710 [PSH, ACK] Seq=114 Ack=1738 Win=8326 Len=10 TSval=453620 TSecr=1542825205"
"86","1.025422531","12:26:37.444187117","192.168.57.30","192.168.57.20","TCP","76","56913  >  7710 [PSH, ACK] Seq=124 Ack=1859 Win=8326 Len=10 TSval=453629 TSecr=1542825242"
"93","1.125379731","12:26:37.544144317","192.168.57.30","192.168.57.20","TCP","76","56913  >  7710 [PSH, ACK] Seq=134 Ack=1979 Win=8326 Len=10 TSval=453638 TSecr=1542825343"
"102","1.225341872","12:26:37.644106458","192.168.57.30","192.168.57.20","TCP","76","56913  >  7710 [PSH, ACK] Seq=144 Ack=2096 Win=8326 Len=10 TSval=453646 TSecr=1542825443"
"109","1.325335767","12:26:37.744100353","192.168.57.30","192.168.57.20","TCP","76","56913  >  7710 [PSH, ACK] Seq=154 Ack=2217 Win=8326 Len=10 TSval=453656 TSecr=1542825543"
"116","1.425306750","12:26:37.844071336","192.168.57.30","192.168.57.20","TCP","76","56913  >  7710 [PSH, ACK] Seq=164 Ack=2343 Win=8326 Len=10 TSval=453665 TSecr=1542825642"
"123","1.525351222","12:26:37.944115808","192.168.57.30","192.168.57.20","TCP","76","56913  >  7710 [PSH, ACK] Seq=174 Ack=2464 Win=8326 Len=10 TSval=453674 TSecr=1542825742"
"134","1.625367728","12:26:38.044132314","192.168.57.30","192.168.57.20","TCP","76","56913  >  7710 [PSH, ACK] Seq=194 Ack=3047 Win=8326 Len=10 TSval=453683 TSecr=1542825843"
"141","1.725318215","12:26:38.144082801","192.168.57.30","192.168.57.20","TCP","76","56913  >  7710 [PSH, ACK] Seq=204 Ack=3168 Win=8326 Len=10 TSval=453692 TSecr=1542825943"
"148","1.825400032","12:26:38.244164618","192.168.57.30","192.168.57.20","TCP","76","56913  >  7710 [PSH, ACK] Seq=214 Ack=3293 Win=8326 Len=10 TSval=453701 TSecr=1542826042"
"155","1.925338248","12:26:38.344102834","192.168.57.30","192.168.57.20","TCP","76","56913  >  7710 [PSH, ACK] Seq=224 Ack=3415 Win=8326 Len=10 TSval=453710 TSecr=1542826142"
"168","2.025336812","12:26:38.444101398","192.168.57.30","192.168.57.20","TCP","76","56913  >  7710 [PSH, ACK] Seq=234 Ack=3536 Win=8326 Len=10 TSval=453719 TSecr=1542826242"
"175","2.125392074","12:26:38.544156660","192.168.57.30","192.168.57.20","TCP","76","56913  >  7710 [PSH, ACK] Seq=244 Ack=3656 Win=8326 Len=10 TSval=453728 TSecr=1542826343"
"184","2.225395813","12:26:38.644160399","192.168.57.30","192.168.57.20","TCP","76","56913  >  7710 [PSH, ACK] Seq=254 Ack=3773 Win=8326 Len=10 TSval=453736 TSecr=1542826442"
"191","2.325364364","12:26:38.744128950","192.168.57.30","192.168.57.20","TCP","76","56913  >  7710 [PSH, ACK] Seq=264 Ack=3894 Win=8326 Len=10 TSval=453745 TSecr=1542826543"
"198","2.425341820","12:26:38.844106406","192.168.57.30","192.168.57.20","TCP","76","56913  >  7710 [PSH, ACK] Seq=274 Ack=4020 Win=8326 Len=10 TSval=453754 TSecr=1542826642"
"205","2.525319690","12:26:38.944084276","192.168.57.30","192.168.57.20","TCP","76","56913  >  7710 [PSH, ACK] Seq=284 Ack=4141 Win=8326 Len=10 TSval=453763 TSecr=1542826742"
"216","2.625402456","12:26:39.044167042","192.168.57.30","192.168.57.20","TCP","76","56913  >  7710 [PSH, ACK] Seq=304 Ack=4724 Win=8326 Len=10 TSval=453772 TSecr=1542826842"
"223","2.725349624","12:26:39.144114210","192.168.57.30","192.168.57.20","TCP","76","56913  >  7710 [PSH, ACK] Seq=314 Ack=4845 Win=8326 Len=10 TSval=453781 TSecr=1542826942"
"230","2.825361478","12:26:39.244126064","192.168.57.30","192.168.57.20","TCP","76","56913  >  7710 [PSH, ACK] Seq=324 Ack=4970 Win=8326 Len=10 TSval=453790 TSecr=1542827042"
"239","2.925350136","12:26:39.344114722","192.168.57.30","192.168.57.20","TCP","76","56913  >  7710 [PSH, ACK] Seq=347 Ack=5273 Win=8326 Len=10 TSval=453799 TSecr=1542827205"
"251","3.025362482","12:26:39.444127068","192.168.57.30","192.168.57.20","TCP","76","56913  >  7710 [PSH, ACK] Seq=357 Ack=5394 Win=8326 Len=10 TSval=453808 TSecr=1542827242"
"258","3.125384896","12:26:39.544149482","192.168.57.30","192.168.57.20","TCP","76","56913  >  7710 [PSH, ACK] Seq=367 Ack=5514 Win=8326 Len=10 TSval=453817 TSecr=1542827343"
"267","3.225421488","12:26:39.644186074","192.168.57.30","192.168.57.20","TCP","76","56913  >  7710 [PSH, ACK] Seq=377 Ack=5631 Win=8326 Len=10 TSval=453826 TSecr=1542827443"
"274","3.325375847","12:26:39.744140433","192.168.57.30","192.168.57.20","TCP","76","56913  >  7710 [PSH, ACK] Seq=387 Ack=5752 Win=8326 Len=10 TSval=453835 TSecr=1542827543"
"281","3.425360212","12:26:39.844124798","192.168.57.30","192.168.57.20","TCP","76","56913  >  7710 [PSH, ACK] Seq=397 Ack=5878 Win=8326 Len=10 TSval=453844 TSecr=1542827642"
"288","3.525364059","12:26:39.944128645","192.168.57.30","192.168.57.20","TCP","76","56913  >  7710 [PSH, ACK] Seq=407 Ack=5999 Win=8326 Len=10 TSval=453853 TSecr=1542827742"
"299","3.625382736","12:26:40.044147322","192.168.57.30","192.168.57.20","TCP","76","56913  >  7710 [PSH, ACK] Seq=427 Ack=6582 Win=8326 Len=10 TSval=453862 TSecr=1542827843"
"306","3.725363809","12:26:40.144128395","192.168.57.30","192.168.57.20","TCP","76","56913  >  7710 [PSH, ACK] Seq=437 Ack=6703 Win=8326 Len=10 TSval=453871 TSecr=1542827942"
"313","3.825367203","12:26:40.244131789","192.168.57.30","192.168.57.20","TCP","76","56913  >  7710 [PSH, ACK] Seq=447 Ack=6828 Win=8326 Len=10 TSval=453880 TSecr=1542828042"
"320","3.925362746","12:26:40.344127332","192.168.57.30","192.168.57.20","TCP","76","56913  >  7710 [PSH, ACK] Seq=457 Ack=6950 Win=8326 Len=10 TSval=453889 TSecr=1542828142"
"333","4.025355688","12:26:40.444120274","192.168.57.30","192.168.57.20","TCP","76","56913  >  7710 [PSH, ACK] Seq=467 Ack=7071 Win=8326 Len=10 TSval=453898 TSecr=1542828242"
"340","4.125379994","12:26:40.544144580","192.168.57.30","192.168.57.20","TCP","76","56913  >  7710 [PSH, ACK] Seq=477 Ack=7191 Win=8326 Len=10 TSval=453907 TSecr=1542828343"
"349","4.225394091","12:26:40.644158677","192.168.57.30","192.168.57.20","TCP","76","56913  >  7710 [PSH, ACK] Seq=487 Ack=7308 Win=8326 Len=10 TSval=453915 TSecr=1542828442"
"356","4.325369635","12:26:40.744134221","192.168.57.30","192.168.57.20","TCP","76","56913  >  7710 [PSH, ACK] Seq=497 Ack=7429 Win=8326 Len=10 TSval=453925 TSecr=1542828543"
"363","4.425346631","12:26:40.844111217","192.168.57.30","192.168.57.20","TCP","76","56913  >  7710 [PSH, ACK] Seq=507 Ack=7555 Win=8326 Len=10 TSval=453934 TSecr=1542828642"
"370","4.525344184","12:26:40.944108770","192.168.57.30","192.168.57.20","TCP","76","56913  >  7710 [PSH, ACK] Seq=517 Ack=7676 Win=8326 Len=10 TSval=453943 TSecr=1542828742"
"381","4.625391523","12:26:41.044156109","192.168.57.30","192.168.57.20","TCP","76","56913  >  7710 [PSH, ACK] Seq=537 Ack=8259 Win=8326 Len=10 TSval=453952 TSecr=1542828843"
"388","4.725351150","12:26:41.144115736","192.168.57.30","192.168.57.20","TCP","76","56913  >  7710 [PSH, ACK] Seq=547 Ack=8380 Win=8326 Len=10 TSval=453961 TSecr=1542828942"
"395","4.825359546","12:26:41.244124132","192.168.57.30","192.168.57.20","TCP","76","56913  >  7710 [PSH, ACK] Seq=557 Ack=8505 Win=8326 Len=10 TSval=453970 TSecr=1542829042"
"404","4.925349107","12:26:41.344113693","192.168.57.30","192.168.57.20","TCP","76","56913  >  7710 [PSH, ACK] Seq=580 Ack=8808 Win=8326 Len=10 TSval=453979 TSecr=1542829203"
"417","5.025349300","12:26:41.444113886","192.168.57.30","192.168.57.20","TCP","76","56913  >  7710 [PSH, ACK] Seq=590 Ack=8929 Win=8326 Len=10 TSval=453988 TSecr=1542829242"
"424","5.125386521","12:26:41.544151107","192.168.57.30","192.168.57.20","TCP","76","56913  >  7710 [PSH, ACK] Seq=600 Ack=9049 Win=8326 Len=10 TSval=453997 TSecr=1542829342"
"433","5.225364459","12:26:41.644129045","192.168.57.30","192.168.57.20","TCP","76","56913  >  7710 [PSH, ACK] Seq=610 Ack=9166 Win=8326 Len=10 TSval=454006 TSecr=1542829442"
"440","5.325398373","12:26:41.744162959","192.168.57.30","192.168.57.20","TCP","76","56913  >  7710 [PSH, ACK] Seq=620 Ack=9287 Win=8326 Len=10 TSval=454015 TSecr=1542829542"
"447","5.425337159","12:26:41.844101745","192.168.57.30","192.168.57.20","TCP","76","56913  >  7710 [PSH, ACK] Seq=630 Ack=9413 Win=8326 Len=10 TSval=454024 TSecr=1542829643"
"454","5.525361259","12:26:41.944125845","192.168.57.30","192.168.57.20","TCP","76","56913  >  7710 [PSH, ACK] Seq=640 Ack=9534 Win=8326 Len=10 TSval=454033 TSecr=1542829742"
"465","5.625399481","12:26:42.044164067","192.168.57.30","192.168.57.20","TCP","76","56913  >  7710 [PSH, ACK] Seq=660 Ack=10117 Win=8326 Len=10 TSval=454042 TSecr=1542829843"
"472","5.725358455","12:26:42.144123041","192.168.57.30","192.168.57.20","TCP","76","56913  >  7710 [PSH, ACK] Seq=670 Ack=10238 Win=8326 Len=10 TSval=454051 TSecr=1542829942"
"479","5.825358599","12:26:42.244123185","192.168.57.30","192.168.57.20","TCP","76","56913  >  7710 [PSH, ACK] Seq=680 Ack=10363 Win=8326 Len=10 TSval=454060 TSecr=1542830042"
"486","5.925422437","12:26:42.344187023","192.168.57.30","192.168.57.20","TCP","76","56913  >  7710 [PSH, ACK] Seq=690 Ack=10485 Win=8326 Len=10 TSval=454069 TSecr=1542830142"
"499","6.025459374","12:26:42.444223960","192.168.57.30","192.168.57.20","TCP","76","56913  >  7710 [PSH, ACK] Seq=700 Ack=10606 Win=8326 Len=10 TSval=454078 TSecr=1542830243"
"506","6.125376634","12:26:42.544141220","192.168.57.30","192.168.57.20","TCP","76","56913  >  7710 [PSH, ACK] Seq=710 Ack=10726 Win=8326 Len=10 TSval=454087 TSecr=1542830343"
"515","6.225352364","12:26:42.644116950","192.168.57.30","192.168.57.20","TCP","76","56913  >  7710 [PSH, ACK] Seq=720 Ack=10843 Win=8326 Len=10 TSval=454096 TSecr=1542830442"
"522","6.325394189","12:26:42.744158775","192.168.57.30","192.168.57.20","TCP","76","56913  >  7710 [PSH, ACK] Seq=730 Ack=10964 Win=8326 Len=10 TSval=454105 TSecr=1542830542"
"529","6.425392855","12:26:42.844157441","192.168.57.30","192.168.57.20","TCP","76","56913  >  7710 [PSH, ACK] Seq=740 Ack=11090 Win=8326 Len=10 TSval=454114 TSecr=1542830643"
"536","6.525330644","12:26:42.944095230","192.168.57.30","192.168.57.20","TCP","76","56913  >  7710 [PSH, ACK] Seq=750 Ack=11211 Win=8326 Len=10 TSval=454123 TSecr=1542830742"
"547","6.625378872","12:26:43.044143458","192.168.57.30","192.168.57.20","TCP","76","56913  >  7710 [PSH, ACK] Seq=770 Ack=11794 Win=8326 Len=10 TSval=454132 TSecr=1542830843"
"554","6.725353137","12:26:43.144117723","192.168.57.30","192.168.57.20","TCP","76","56913  >  7710 [PSH, ACK] Seq=780 Ack=11915 Win=8326 Len=10 TSval=454141 TSecr=1542830942"
"561","6.825358078","12:26:43.244122664","192.168.57.30","192.168.57.20","TCP","76","56913  >  7710 [PSH, ACK] Seq=790 Ack=12040 Win=8326 Len=10 TSval=454150 TSecr=1542831042"
"570","6.925346165","12:26:43.344110751","192.168.57.30","192.168.57.20","TCP","76","56913  >  7710 [PSH, ACK] Seq=813 Ack=12343 Win=8326 Len=10 TSval=454159 TSecr=1542831210"
"583","7.025327252","12:26:43.444091838","192.168.57.30","192.168.57.20","TCP","76","56913  >  7710 [PSH, ACK] Seq=823 Ack=12464 Win=8326 Len=10 TSval=454168 TSecr=1542831242"
"590","7.125429740","12:26:43.544194326","192.168.57.30","192.168.57.20","TCP","76","56913  >  7710 [PSH, ACK] Seq=833 Ack=12584 Win=8326 Len=10 TSval=454177 TSecr=1542831342"
"599","7.225365206","12:26:43.644129792","192.168.57.30","192.168.57.20","TCP","76","56913  >  7710 [PSH, ACK] Seq=843 Ack=12701 Win=8326 Len=10 TSval=454186 TSecr=1542831443"
"606","7.325427297","12:26:43.744191883","192.168.57.30","192.168.57.20","TCP","76","56913  >  7710 [PSH, ACK] Seq=853 Ack=12822 Win=8326 Len=10 TSval=454196 TSecr=1542831532"
"613","7.425352033","12:26:43.844116619","192.168.57.30","192.168.57.20","TCP","76","56913  >  7710 [PSH, ACK] Seq=863 Ack=12948 Win=8326 Len=10 TSval=454205 TSecr=1542831643"
"620","7.525352152","12:26:43.944116738","192.168.57.30","192.168.57.20","TCP","76","56913  >  7710 [PSH, ACK] Seq=873 Ack=13069 Win=8326 Len=10 TSval=454214 TSecr=1542831733"
"631","7.625370715","12:26:44.044135301","192.168.57.30","192.168.57.20","TCP","76","56913  >  7710 [PSH, ACK] Seq=893 Ack=13652 Win=8326 Len=10 TSval=454223 TSecr=1542831842"
"638","7.725367406","12:26:44.144131992","192.168.57.30","192.168.57.20","TCP","76","56913  >  7710 [PSH, ACK] Seq=903 Ack=13773 Win=8326 Len=10 TSval=454232 TSecr=1542831942"
"645","7.825363097","12:26:44.244127683","192.168.57.30","192.168.57.20","TCP","76","56913  >  7710 [PSH, ACK] Seq=913 Ack=13898 Win=8326 Len=10 TSval=454241 TSecr=1542832035"
"652","7.925358799","12:26:44.344123385","192.168.57.30","192.168.57.20","TCP","76","56913  >  7710 [PSH, ACK] Seq=923 Ack=14020 Win=8326 Len=10 TSval=454250 TSecr=1542832142"
"662","8.025273838","12:26:44.444038424","192.168.57.30","192.168.57.20","TCP","76","56913  >  7710 [PSH, ACK] Seq=933 Ack=14141 Win=8326 Len=10 TSval=454259 TSecr=1542832237"
"672","8.125357319","12:26:44.544121905","192.168.57.30","192.168.57.20","TCP","76","56913  >  7710 [PSH, ACK] Seq=943 Ack=14261 Win=8326 Len=10 TSval=454268 TSecr=1542832342"
"681","8.225303375","12:26:44.644067961","192.168.57.30","192.168.57.20","TCP","76","56913  >  7710 [PSH, ACK] Seq=953 Ack=14378 Win=8326 Len=10 TSval=454277 TSecr=1542832438"
"688","8.325374830","12:26:44.744139416","192.168.57.30","192.168.57.20","TCP","76","56913  >  7710 [PSH, ACK] Seq=963 Ack=14499 Win=8326 Len=10 TSval=454286 TSecr=1542832539"
"695","8.425385659","12:26:44.844150245","192.168.57.30","192.168.57.20","TCP","76","56913  >  7710 [PSH, ACK] Seq=973 Ack=14625 Win=8326 Len=10 TSval=454295 TSecr=1542832640"
"702","8.525277150","12:26:44.944041736","192.168.57.30","192.168.57.20","TCP","76","56913  >  7710 [PSH, ACK] Seq=983 Ack=14746 Win=8326 Len=10 TSval=454304 TSecr=1542832740"
"712","8.625372454","12:26:45.044137040","192.168.57.30","192.168.57.20","TCP","76","56913  >  7710 [PSH, ACK] Seq=1003 Ack=15329 Win=8326 Len=10 TSval=454313 TSecr=1542832842"
"718","8.725361470","12:26:45.144126056","192.168.57.30","192.168.57.20","TCP","76","56913  >  7710 [PSH, ACK] Seq=1013 Ack=15450 Win=8326 Len=10 TSval=454322 TSecr=1542832942"
"725","8.825377993","12:26:45.244142579","192.168.57.30","192.168.57.20","TCP","76","56913  >  7710 [PSH, ACK] Seq=1023 Ack=15575 Win=8326 Len=10 TSval=454331 TSecr=1542833042"
"734","8.925354521","12:26:45.344119107","192.168.57.30","192.168.57.20","TCP","76","56913  >  7710 [PSH, ACK] Seq=1046 Ack=15878 Win=8326 Len=10 TSval=454340 TSecr=1542833206"
"741","9.025371551","12:26:45.444136137","192.168.57.30","192.168.57.20","TCP","76","56913  >  7710 [PSH, ACK] Seq=1056 Ack=15999 Win=8326 Len=10 TSval=454349 TSecr=1542833242"
"754","9.125371709","12:26:45.544136295","192.168.57.30","192.168.57.20","TCP","76","56913  >  7710 [PSH, ACK] Seq=1066 Ack=16119 Win=8326 Len=10 TSval=454358 TSecr=1542833343"
"761","9.225347614","12:26:45.644112200","192.168.57.30","192.168.57.20","TCP","76","56913  >  7710 [PSH, ACK] Seq=1076 Ack=16236 Win=8326 Len=10 TSval=454367 TSecr=1542833443"
"770","9.325378620","12:26:45.744143206","192.168.57.30","192.168.57.20","TCP","76","56913  >  7710 [PSH, ACK] Seq=1086 Ack=16357 Win=8326 Len=10 TSval=454376 TSecr=1542833542"
"777","9.425390468","12:26:45.844155054","192.168.57.30","192.168.57.20","TCP","76","56913  >  7710 [PSH, ACK] Seq=1096 Ack=16483 Win=8326 Len=10 TSval=454385 TSecr=1542833642"
"784","9.525367687","12:26:45.944132273","192.168.57.30","192.168.57.20","TCP","76","56913  >  7710 [PSH, ACK] Seq=1106 Ack=16604 Win=8326 Len=10 TSval=454394 TSecr=1542833742"
"795","9.625363870","12:26:46.044128456","192.168.57.30","192.168.57.20","TCP","76","56913  >  7710 [PSH, ACK] Seq=1126 Ack=17187 Win=8326 Len=10 TSval=454403 TSecr=1542833843"
"802","9.725342935","12:26:46.144107521","192.168.57.30","192.168.57.20","TCP","76","56913  >  7710 [PSH, ACK] Seq=1136 Ack=17308 Win=8326 Len=10 TSval=454412 TSecr=1542833942"
"809","9.825373345","12:26:46.244137931","192.168.57.30","192.168.57.20","TCP","76","56913  >  7710 [PSH, ACK] Seq=1146 Ack=17433 Win=8326 Len=10 TSval=454421 TSecr=1542834042"
"816","9.925335081","12:26:46.344099667","192.168.57.30","192.168.57.20","TCP","76","56913  >  7710 [PSH, ACK] Seq=1156 Ack=17555 Win=8326 Len=10 TSval=454430 TSecr=1542834142"
"823","10.025362585","12:26:46.444127171","192.168.57.30","192.168.57.20","TCP","76","56913  >  7710 [PSH, ACK] Seq=1166 Ack=17676 Win=8326 Len=10 TSval=454439 TSecr=1542834242"
"836","10.125355984","12:26:46.544120570","192.168.57.30","192.168.57.20","TCP","76","56913  >  7710 [PSH, ACK] Seq=1176 Ack=17796 Win=8326 Len=10 TSval=454448 TSecr=1542834343"
"843","10.225345415","12:26:46.644110001","192.168.57.30","192.168.57.20","TCP","76","56913  >  7710 [PSH, ACK] Seq=1186 Ack=17913 Win=8326 Len=10 TSval=454457 TSecr=1542834442"
"852","10.325351569","12:26:46.744116155","192.168.57.30","192.168.57.20","TCP","76","56913  >  7710 [PSH, ACK] Seq=1196 Ack=18034 Win=8326 Len=10 TSval=454466 TSecr=1542834542"
"859","10.425346248","12:26:46.844110834","192.168.57.30","192.168.57.20","TCP","76","56913  >  7710 [PSH, ACK] Seq=1206 Ack=18160 Win=8326 Len=10 TSval=454475 TSecr=1542834642"
"866","10.525322928","12:26:46.944087514","192.168.57.30","192.168.57.20","TCP","76","56913  >  7710 [PSH, ACK] Seq=1216 Ack=18281 Win=8326 Len=10 TSval=454484 TSecr=1542834742"
"877","10.625376648","12:26:47.044141234","192.168.57.30","192.168.57.20","TCP","76","56913  >  7710 [PSH, ACK] Seq=1236 Ack=18864 Win=8326 Len=10 TSval=454493 TSecr=1542834842"
"884","10.725333577","12:26:47.144098163","192.168.57.30","192.168.57.20","TCP","76","56913  >  7710 [PSH, ACK] Seq=1246 Ack=18985 Win=8326 Len=10 TSval=454502 TSecr=1542834942"
"891","10.825364129","12:26:47.244128715","192.168.57.30","192.168.57.20","TCP","76","56913  >  7710 [PSH, ACK] Seq=1256 Ack=19110 Win=8326 Len=10 TSval=454511 TSecr=1542835042"
"900","10.925479801","12:26:47.344244387","192.168.57.30","192.168.57.20","TCP","76","56913  >  7710 [PSH, ACK] Seq=1279 Ack=19413 Win=8326 Len=10 TSval=454520 TSecr=1542835205"
"907","11.025709764","12:26:47.444474350","192.168.57.30","192.168.57.20","TCP","76","56913  >  7710 [PSH, ACK] Seq=1289 Ack=19534 Win=8326 Len=10 TSval=454529 TSecr=1542835243"
"920","11.125341608","12:26:47.544106194","192.168.57.30","192.168.57.20","TCP","76","56913  >  7710 [PSH, ACK] Seq=1299 Ack=19654 Win=8326 Len=10 TSval=454538 TSecr=1542835343"
"927","11.225346232","12:26:47.644110818","192.168.57.30","192.168.57.20","TCP","76","56913  >  7710 [PSH, ACK] Seq=1309 Ack=19771 Win=8326 Len=10 TSval=454547 TSecr=1542835442"
"936","11.325323062","12:26:47.744087648","192.168.57.30","192.168.57.20","TCP","76","56913  >  7710 [PSH, ACK] Seq=1319 Ack=19892 Win=8326 Len=10 TSval=454556 TSecr=1542835542"
"943","11.425325783","12:26:47.844090369","192.168.57.30","192.168.57.20","TCP","76","56913  >  7710 [PSH, ACK] Seq=1329 Ack=20018 Win=8326 Len=10 TSval=454565 TSecr=1542835642"
"950","11.525392571","12:26:47.944157157","192.168.57.30","192.168.57.20","TCP","76","56913  >  7710 [PSH, ACK] Seq=1339 Ack=20139 Win=8326 Len=10 TSval=454574 TSecr=1542835742"
"961","11.625333900","12:26:48.044098486","192.168.57.30","192.168.57.20","TCP","76","56913  >  7710 [PSH, ACK] Seq=1359 Ack=20722 Win=8326 Len=10 TSval=454583 TSecr=1542835843"
"968","11.725311838","12:26:48.144076424","192.168.57.30","192.168.57.20","TCP","76","56913  >  7710 [PSH, ACK] Seq=1369 Ack=20843 Win=8326 Len=10 TSval=454592 TSecr=1542835942"
"975","11.825330124","12:26:48.244094710","192.168.57.30","192.168.57.20","TCP","76","56913  >  7710 [PSH, ACK] Seq=1379 Ack=20968 Win=8326 Len=10 TSval=454601 TSecr=1542836033"
"982","11.925312754","12:26:48.344077340","192.168.57.30","192.168.57.20","TCP","76","56913  >  7710 [PSH, ACK] Seq=1389 Ack=21090 Win=8326 Len=10 TSval=454610 TSecr=1542836142"
"989","12.025300091","12:26:48.444064677","192.168.57.30","192.168.57.20","TCP","76","56913  >  7710 [PSH, ACK] Seq=1399 Ack=21211 Win=8326 Len=10 TSval=454619 TSecr=1542836235"
"1002","12.125329893","12:26:48.544094479","192.168.57.30","192.168.57.20","TCP","76","56913  >  7710 [PSH, ACK] Seq=1409 Ack=21331 Win=8326 Len=10 TSval=454628 TSecr=1542836342"
"1009","12.225311341","12:26:48.644075927","192.168.57.30","192.168.57.20","TCP","76","56913  >  7710 [PSH, ACK] Seq=1419 Ack=21448 Win=8326 Len=10 TSval=454636 TSecr=1542836437"
"1018","12.325316568","12:26:48.744081154","192.168.57.30","192.168.57.20","TCP","76","56913  >  7710 [PSH, ACK] Seq=1429 Ack=21569 Win=8326 Len=10 TSval=454646 TSecr=1542836537"
"1025","12.425315567","12:26:48.844080153","192.168.57.30","192.168.57.20","TCP","76","56913  >  7710 [PSH, ACK] Seq=1439 Ack=21695 Win=8326 Len=10 TSval=454655 TSecr=1542836642"
"1032","12.525359743","12:26:48.944124329","192.168.57.30","192.168.57.20","TCP","76","56913  >  7710 [PSH, ACK] Seq=1449 Ack=21816 Win=8326 Len=10 TSval=454664 TSecr=1542836738"
"1043","12.625336752","12:26:49.044101338","192.168.57.30","192.168.57.20","TCP","76","56913  >  7710 [PSH, ACK] Seq=1469 Ack=22399 Win=8326 Len=10 TSval=454673 TSecr=1542836843"
"1050","12.725318619","12:26:49.144083205","192.168.57.30","192.168.57.20","TCP","76","56913  >  7710 [PSH, ACK] Seq=1479 Ack=22520 Win=8326 Len=10 TSval=454682 TSecr=1542836940"
"1057","12.825282062","12:26:49.244046648","192.168.57.30","192.168.57.20","TCP","76","56913  >  7710 [PSH, ACK] Seq=1489 Ack=22645 Win=8326 Len=10 TSval=454691 TSecr=1542837040"
"1066","12.925351779","12:26:49.344116365","192.168.57.30","192.168.57.20","TCP","76","56913  >  7710 [PSH, ACK] Seq=1512 Ack=22948 Win=8326 Len=10 TSval=454700 TSecr=1542837203"
"1073","13.025285869","12:26:49.444050455","192.168.57.30","192.168.57.20","TCP","76","56913  >  7710 [PSH, ACK] Seq=1522 Ack=23069 Win=8326 Len=10 TSval=454709 TSecr=1542837242"
"1086","13.125374970","12:26:49.544139556","192.168.57.30","192.168.57.20","TCP","76","56913  >  7710 [PSH, ACK] Seq=1532 Ack=23189 Win=8326 Len=10 TSval=454718 TSecr=1542837345"
"1093","13.225348956","12:26:49.644113542","192.168.57.30","192.168.57.20","TCP","76","56913  >  7710 [PSH, ACK] Seq=1542 Ack=23306 Win=8326 Len=10 TSval=454727 TSecr=1542837442"
"1102","13.325363020","12:26:49.744127606","192.168.57.30","192.168.57.20","TCP","76","56913  >  7710 [PSH, ACK] Seq=1552 Ack=23427 Win=8326 Len=10 TSval=454736 TSecr=1542837543"
"1109","13.425347066","12:26:49.844111652","192.168.57.30","192.168.57.20","TCP","76","56913  >  7710 [PSH, ACK] Seq=1562 Ack=23553 Win=8326 Len=10 TSval=454745 TSecr=1542837639"
"1116","13.525334417","12:26:49.944099003","192.168.57.30","192.168.57.20","TCP","76","56913  >  7710 [PSH, ACK] Seq=1572 Ack=23674 Win=8326 Len=10 TSval=454754 TSecr=1542837742"
"1127","13.625793235","12:26:50.044557821","192.168.57.30","192.168.57.20","TCP","76","56913  >  7710 [PSH, ACK] Seq=1592 Ack=24257 Win=8326 Len=10 TSval=454763 TSecr=1542837842"
"1134","13.725338397","12:26:50.144102983","192.168.57.30","192.168.57.20","TCP","76","56913  >  7710 [PSH, ACK] Seq=1602 Ack=24378 Win=8326 Len=10 TSval=454772 TSecr=1542837936"
"1141","13.825361099","12:26:50.244125685","192.168.57.30","192.168.57.20","TCP","76","56913  >  7710 [PSH, ACK] Seq=1612 Ack=24503 Win=8326 Len=10 TSval=454781 TSecr=1542838042"
"1148","13.925328604","12:26:50.344093190","192.168.57.30","192.168.57.20","TCP","76","56913  >  7710 [PSH, ACK] Seq=1622 Ack=24625 Win=8326 Len=10 TSval=454790 TSecr=1542838142"
"1155","14.025343975","12:26:50.444108561","192.168.57.30","192.168.57.20","TCP","76","56913  >  7710 [PSH, ACK] Seq=1632 Ack=24746 Win=8326 Len=10 TSval=454799 TSecr=1542838233"
"1168","14.125369268","12:26:50.544133854","192.168.57.30","192.168.57.20","TCP","76","56913  >  7710 [PSH, ACK] Seq=1642 Ack=24866 Win=8326 Len=10 TSval=454808 TSecr=1542838342"
"1175","14.225332379","12:26:50.644096965","192.168.57.30","192.168.57.20","TCP","76","56913  >  7710 [PSH, ACK] Seq=1652 Ack=24983 Win=8326 Len=10 TSval=454817 TSecr=1542838443"
"1184","14.325356399","12:26:50.744120985","192.168.57.30","192.168.57.20","TCP","76","56913  >  7710 [PSH, ACK] Seq=1662 Ack=25104 Win=8326 Len=10 TSval=454826 TSecr=1542838542"
"1191","14.425343169","12:26:50.844107755","192.168.57.30","192.168.57.20","TCP","76","56913  >  7710 [PSH, ACK] Seq=1672 Ack=25230 Win=8326 Len=10 TSval=454835 TSecr=1542838642"
"1198","14.525314464","12:26:50.944079050","192.168.57.30","192.168.57.20","TCP","76","56913  >  7710 [PSH, ACK] Seq=1682 Ack=25351 Win=8326 Len=10 TSval=454844 TSecr=1542838742"
"1209","14.625363162","12:26:51.044127748","192.168.57.30","192.168.57.20","TCP","76","56913  >  7710 [PSH, ACK] Seq=1702 Ack=25934 Win=8326 Len=10 TSval=454853 TSecr=1542838849"
"1216","14.725366947","12:26:51.144131533","192.168.57.30","192.168.57.20","TCP","76","56913  >  7710 [PSH, ACK] Seq=1712 Ack=26055 Win=8326 Len=10 TSval=454862 TSecr=1542838942"
"1223","14.825355816","12:26:51.244120402","192.168.57.30","192.168.57.20","TCP","76","56913  >  7710 [PSH, ACK] Seq=1722 Ack=26180 Win=8326 Len=10 TSval=454871 TSecr=1542839042"
"1232","14.925338785","12:26:51.344103371","192.168.57.30","192.168.57.20","TCP","76","56913  >  7710 [PSH, ACK] Seq=1745 Ack=26483 Win=8326 Len=10 TSval=454880 TSecr=1542839204"
"1239","15.025335903","12:26:51.444100489","192.168.57.30","192.168.57.20","TCP","76","56913  >  7710 [PSH, ACK] Seq=1755 Ack=26604 Win=8326 Len=10 TSval=454889 TSecr=1542839242"
"1252","15.125370263","12:26:51.544134849","192.168.57.30","192.168.57.20","TCP","76","56913  >  7710 [PSH, ACK] Seq=1765 Ack=26724 Win=8326 Len=10 TSval=454898 TSecr=1542839342"
"1259","15.225338557","12:26:51.644103143","192.168.57.30","192.168.57.20","TCP","76","56913  >  7710 [PSH, ACK] Seq=1775 Ack=26841 Win=8326 Len=10 TSval=454907 TSecr=1542839442"
"1268","15.325357763","12:26:51.744122349","192.168.57.30","192.168.57.20","TCP","76","56913  >  7710 [PSH, ACK] Seq=1785 Ack=26962 Win=8326 Len=10 TSval=454916 TSecr=1542839542"
"1275","15.425331437","12:26:51.844096023","192.168.57.30","192.168.57.20","TCP","76","56913  >  7710 [PSH, ACK] Seq=1795 Ack=27088 Win=8326 Len=10 TSval=454925 TSecr=1542839642"
"1282","15.525338012","12:26:51.944102598","192.168.57.30","192.168.57.20","TCP","76","56913  >  7710 [PSH, ACK] Seq=1805 Ack=27209 Win=8326 Len=10 TSval=454934 TSecr=1542839742"
"1293","15.625425189","12:26:52.044189775","192.168.57.30","192.168.57.20","TCP","76","56913  >  7710 [PSH, ACK] Seq=1825 Ack=27792 Win=8326 Len=10 TSval=454943 TSecr=1542839849"
"1300","15.725351853","12:26:52.144116439","192.168.57.30","192.168.57.20","TCP","76","56913  >  7710 [PSH, ACK] Seq=1835 Ack=27913 Win=8326 Len=10 TSval=454952 TSecr=1542839942"
"1307","15.825306410","12:26:52.244070996","192.168.57.30","192.168.57.20","TCP","76","56913  >  7710 [PSH, ACK] Seq=1845 Ack=28038 Win=8326 Len=10 TSval=454961 TSecr=1542840042"
"1314","15.925438974","12:26:52.344203560","192.168.57.30","192.168.57.20","TCP","76","56913  >  7710 [PSH, ACK] Seq=1855 Ack=28160 Win=8326 Len=10 TSval=454970 TSecr=1542840142"
"1321","16.026130913","12:26:52.444895499","192.168.57.30","192.168.57.20","TCP","76","56913  >  7710 [PSH, ACK] Seq=1865 Ack=28281 Win=8326 Len=10 TSval=454979 TSecr=1542840243"
"1333","16.125361850","12:26:52.544126436","192.168.57.30","192.168.57.20","TCP","76","56913  >  7710 [PSH, ACK] Seq=1875 Ack=28401 Win=8326 Len=10 TSval=454988 TSecr=1542840343"
"1341","16.225349829","12:26:52.644114415","192.168.57.30","192.168.57.20","TCP","76","56913  >  7710 [PSH, ACK] Seq=1885 Ack=28518 Win=8326 Len=10 TSval=454997 TSecr=1542840442"
"1349","16.325349664","12:26:52.744114250","192.168.57.30","192.168.57.20","TCP","76","56913  >  7710 [PSH, ACK] Seq=1895 Ack=28639 Win=8326 Len=10 TSval=455006 TSecr=1542840542"
"1356","16.425324980","12:26:52.844089566","192.168.57.30","192.168.57.20","TCP","76","56913  >  7710 [PSH, ACK] Seq=1905 Ack=28765 Win=8326 Len=10 TSval=455015 TSecr=1542840642"
"1363","16.525354232","12:26:52.944118818","192.168.57.30","192.168.57.20","TCP","76","56913  >  7710 [PSH, ACK] Seq=1915 Ack=28886 Win=8326 Len=10 TSval=455024 TSecr=1542840742"
"1374","16.625354988","12:26:53.044119574","192.168.57.30","192.168.57.20","TCP","76","56913  >  7710 [PSH, ACK] Seq=1935 Ack=29469 Win=8326 Len=10 TSval=455033 TSecr=1542840849"
"1381","16.725364850","12:26:53.144129436","192.168.57.30","192.168.57.20","TCP","76","56913  >  7710 [PSH, ACK] Seq=1945 Ack=29590 Win=8326 Len=10 TSval=455042 TSecr=1542840942"
"1388","16.825368637","12:26:53.244133223","192.168.57.30","192.168.57.20","TCP","76","56913  >  7710 [PSH, ACK] Seq=1955 Ack=29715 Win=8326 Len=10 TSval=455051 TSecr=1542841042"
"1397","16.925328897","12:26:53.344093483","192.168.57.30","192.168.57.20","TCP","76","56913  >  7710 [PSH, ACK] Seq=1978 Ack=30018 Win=8326 Len=10 TSval=455060 TSecr=1542841205"
"1404","17.025345096","12:26:53.444109682","192.168.57.30","192.168.57.20","TCP","76","56913  >  7710 [PSH, ACK] Seq=1988 Ack=30139 Win=8326 Len=10 TSval=455069 TSecr=1542841242"
"1417","17.125354214","12:26:53.544118800","192.168.57.30","192.168.57.20","TCP","76","56913  >  7710 [PSH, ACK] Seq=1998 Ack=30259 Win=8326 Len=10 TSval=455078 TSecr=1542841342"
"1424","17.225356817","12:26:53.644121403","192.168.57.30","192.168.57.20","TCP","76","56913  >  7710 [PSH, ACK] Seq=2008 Ack=30376 Win=8326 Len=10 TSval=455086 TSecr=1542841442"
"1433","17.325345720","12:26:53.744110306","192.168.57.30","192.168.57.20","TCP","76","56913  >  7710 [PSH, ACK] Seq=2018 Ack=30497 Win=8326 Len=10 TSval=455096 TSecr=1542841542"
"1440","17.425299538","12:26:53.844064124","192.168.57.30","192.168.57.20","TCP","76","56913  >  7710 [PSH, ACK] Seq=2028 Ack=30623 Win=8326 Len=10 TSval=455105 TSecr=1542841642"
"1447","17.525313981","12:26:53.944078567","192.168.57.30","192.168.57.20","TCP","76","56913  >  7710 [PSH, ACK] Seq=2038 Ack=30744 Win=8326 Len=10 TSval=455114 TSecr=1542841742"
"1458","17.625296054","12:26:54.044060640","192.168.57.30","192.168.57.20","TCP","76","56913  >  7710 [PSH, ACK] Seq=2058 Ack=31327 Win=8326 Len=10 TSval=455123 TSecr=1542841849"
"1465","17.725485548","12:26:54.144250134","192.168.57.30","192.168.57.20","TCP","76","56913  >  7710 [PSH, ACK] Seq=2068 Ack=31448 Win=8326 Len=10 TSval=455132 TSecr=1542841942"
"1472","17.825331600","12:26:54.244096186","192.168.57.30","192.168.57.20","TCP","76","56913  >  7710 [PSH, ACK] Seq=2078 Ack=31573 Win=8326 Len=10 TSval=455141 TSecr=1542842043"
"1479","17.925355237","12:26:54.344119823","192.168.57.30","192.168.57.20","TCP","76","56913  >  7710 [PSH, ACK] Seq=2088 Ack=31695 Win=8326 Len=10 TSval=455150 TSecr=1542842142"
"1486","18.025334986","12:26:54.444099572","192.168.57.30","192.168.57.20","TCP","76","56913  >  7710 [PSH, ACK] Seq=2098 Ack=31816 Win=8326 Len=10 TSval=455159 TSecr=1542842242"
"1499","18.125361105","12:26:54.544125691","192.168.57.30","192.168.57.20","TCP","76","56913  >  7710 [PSH, ACK] Seq=2108 Ack=31936 Win=8326 Len=10 TSval=455168 TSecr=1542842342"
"1506","18.225333995","12:26:54.644098581","192.168.57.30","192.168.57.20","TCP","76","56913  >  7710 [PSH, ACK] Seq=2118 Ack=32053 Win=8326 Len=10 TSval=455177 TSecr=1542842443"
"1515","18.325353329","12:26:54.744117915","192.168.57.30","192.168.57.20","TCP","76","56913  >  7710 [PSH, ACK] Seq=2128 Ack=32174 Win=8326 Len=10 TSval=455186 TSecr=1542842542"
"1522","18.425327521","12:26:54.844092107","192.168.57.30","192.168.57.20","TCP","76","56913  >  7710 [PSH, ACK] Seq=2138 Ack=32300 Win=8326 Len=10 TSval=455195 TSecr=1542842642"
"1529","18.525360855","12:26:54.944125441","192.168.57.30","192.168.57.20","TCP","76","56913  >  7710 [PSH, ACK] Seq=2148 Ack=32421 Win=8326 Len=10 TSval=455204 TSecr=1542842742"
"1540","18.625363991","12:26:55.044128577","192.168.57.30","192.168.57.20","TCP","76","56913  >  7710 [PSH, ACK] Seq=2168 Ack=33004 Win=8326 Len=10 TSval=455212 TSecr=1542842843"
"1547","18.725400857","12:26:55.144165443","192.168.57.30","192.168.57.20","TCP","76","56913  >  7710 [PSH, ACK] Seq=2178 Ack=33125 Win=8326 Len=10 TSval=455222 TSecr=1542842942"
"1554","18.825365612","12:26:55.244130198","192.168.57.30","192.168.57.20","TCP","76","56913  >  7710 [PSH, ACK] Seq=2188 Ack=33250 Win=8326 Len=10 TSval=455231 TSecr=1542843042"
"1563","18.925331366","12:26:55.344095952","192.168.57.30","192.168.57.20","TCP","76","56913  >  7710 [PSH, ACK] Seq=2211 Ack=33553 Win=8326 Len=10 TSval=455240 TSecr=1542843219"
"1570","19.025332099","12:26:55.444096685","192.168.57.30","192.168.57.20","TCP","76","56913  >  7710 [PSH, ACK] Seq=2221 Ack=33674 Win=8326 Len=10 TSval=455249 TSecr=1542843242"
"1583","19.125359316","12:26:55.544123902","192.168.57.30","192.168.57.20","TCP","76","56913  >  7710 [PSH, ACK] Seq=2231 Ack=33794 Win=8326 Len=10 TSval=455258 TSecr=1542843342"
"1590","19.225337157","12:26:55.644101743","192.168.57.30","192.168.57.20","TCP","76","56913  >  7710 [PSH, ACK] Seq=2241 Ack=33911 Win=8326 Len=10 TSval=455267 TSecr=1542843442"
"1599","19.325321533","12:26:55.744086119","192.168.57.30","192.168.57.20","TCP","76","56913  >  7710 [PSH, ACK] Seq=2251 Ack=34028 Win=8326 Len=10 TSval=455276 TSecr=1542843542"
"1606","19.425333371","12:26:55.844097957","192.168.57.30","192.168.57.20","TCP","76","56913  >  7710 [PSH, ACK] Seq=2261 Ack=34149 Win=8326 Len=10 TSval=455285 TSecr=1542843642"
"1613","19.525323852","12:26:55.944088438","192.168.57.30","192.168.57.20","TCP","76","56913  >  7710 [PSH, ACK] Seq=2271 Ack=34275 Win=8326 Len=10 TSval=455294 TSecr=1542843742"
"1624","19.625353408","12:26:56.044117994","192.168.57.30","192.168.57.20","TCP","76","56913  >  7710 [PSH, ACK] Seq=2291 Ack=34863 Win=8326 Len=10 TSval=455303 TSecr=1542843843"
"1631","19.725358096","12:26:56.144122682","192.168.57.30","192.168.57.20","TCP","76","56913  >  7710 [PSH, ACK] Seq=2301 Ack=34979 Win=8326 Len=10 TSval=455312 TSecr=1542843942"
"1638","19.825377760","12:26:56.244142346","192.168.57.30","192.168.57.20","TCP","76","56913  >  7710 [PSH, ACK] Seq=2311 Ack=35100 Win=8326 Len=10 TSval=455321 TSecr=1542844042"
"1645","19.925323238","12:26:56.344087824","192.168.57.30","192.168.57.20","TCP","76","56913  >  7710 [PSH, ACK] Seq=2321 Ack=35225 Win=8326 Len=10 TSval=455330 TSecr=1542844142"
"1652","20.025309171","12:26:56.444073757","192.168.57.30","192.168.57.20","TCP","76","56913  >  7710 [PSH, ACK] Seq=2331 Ack=35347 Win=8326 Len=10 TSval=455339 TSecr=1542844242"
"1665","20.125368617","12:26:56.544133203","192.168.57.30","192.168.57.20","TCP","76","56913  >  7710 [PSH, ACK] Seq=2341 Ack=35468 Win=8326 Len=10 TSval=455348 TSecr=1542844328"
"1672","20.225330969","12:26:56.644095555","192.168.57.30","192.168.57.20","TCP","76","56913  >  7710 [PSH, ACK] Seq=2351 Ack=35588 Win=8326 Len=10 TSval=455357 TSecr=1542844442"
"1681","20.325333179","12:26:56.744097765","192.168.57.30","192.168.57.20","TCP","76","56913  >  7710 [PSH, ACK] Seq=2361 Ack=35705 Win=8326 Len=10 TSval=455366 TSecr=1542844542"
"1688","20.425344929","12:26:56.844109515","192.168.57.30","192.168.57.20","TCP","76","56913  >  7710 [PSH, ACK] Seq=2371 Ack=35826 Win=8326 Len=10 TSval=455375 TSecr=1542844642"
"1695","20.525317066","12:26:56.944081652","192.168.57.30","192.168.57.20","TCP","76","56913  >  7710 [PSH, ACK] Seq=2381 Ack=35952 Win=8326 Len=10 TSval=455384 TSecr=1542844742"
"1706","20.625349555","12:26:57.044114141","192.168.57.30","192.168.57.20","TCP","76","56913  >  7710 [PSH, ACK] Seq=2401 Ack=36540 Win=8326 Len=10 TSval=455393 TSecr=1542844849"
"1713","20.725321979","12:26:57.144086565","192.168.57.30","192.168.57.20","TCP","76","56913  >  7710 [PSH, ACK] Seq=2411 Ack=36656 Win=8326 Len=10 TSval=455402 TSecr=1542844942"
"1720","20.825392402","12:26:57.244156988","192.168.57.30","192.168.57.20","TCP","76","56913  >  7710 [PSH, ACK] Seq=2421 Ack=36777 Win=8326 Len=10 TSval=455411 TSecr=1542845033"
"1729","20.925453206","12:26:57.344217792","192.168.57.30","192.168.57.20","TCP","76","56913  >  7710 [PSH, ACK] Seq=2444 Ack=37083 Win=8326 Len=10 TSval=455420 TSecr=1542845219"
"1736","21.025729028","12:26:57.444493614","192.168.57.30","192.168.57.20","TCP","76","56913  >  7710 [PSH, ACK] Seq=2454 Ack=37205 Win=8326 Len=10 TSval=455429 TSecr=1542845235"
"1748","21.125347448","12:26:57.544112034","192.168.57.30","192.168.57.20","TCP","76","56913  >  7710 [PSH, ACK] Seq=2464 Ack=37326 Win=8326 Len=10 TSval=455438 TSecr=1542845343"
"1756","21.225332453","12:26:57.644097039","192.168.57.30","192.168.57.20","TCP","76","56913  >  7710 [PSH, ACK] Seq=2474 Ack=37446 Win=8326 Len=10 TSval=455447 TSecr=1542845442"
"1765","21.325338662","12:26:57.744103248","192.168.57.30","192.168.57.20","TCP","76","56913  >  7710 [PSH, ACK] Seq=2484 Ack=37563 Win=8326 Len=10 TSval=455456 TSecr=1542845537"
"1772","21.425335067","12:26:57.844099653","192.168.57.30","192.168.57.20","TCP","76","56913  >  7710 [PSH, ACK] Seq=2494 Ack=37684 Win=8326 Len=10 TSval=455465 TSecr=1542845642"
"1779","21.525360582","12:26:57.944125168","192.168.57.30","192.168.57.20","TCP","76","56913  >  7710 [PSH, ACK] Seq=2504 Ack=37810 Win=8326 Len=10 TSval=455474 TSecr=1542845739"
"1790","21.625349429","12:26:58.044114015","192.168.57.30","192.168.57.20","TCP","76","56913  >  7710 [PSH, ACK] Seq=2524 Ack=38398 Win=8326 Len=10 TSval=455483 TSecr=1542845849"
"1797","21.725261740","12:26:58.144026326","192.168.57.30","192.168.57.20","TCP","76","56913  >  7710 [PSH, ACK] Seq=2534 Ack=38514 Win=8326 Len=10 TSval=455492 TSecr=1542845940"
"1803","21.825332470","12:26:58.244097056","192.168.57.30","192.168.57.20","TCP","76","56913  >  7710 [PSH, ACK] Seq=2544 Ack=38635 Win=8326 Len=10 TSval=455501 TSecr=1542846041"
"1809","21.925344187","12:26:58.344108773","192.168.57.30","192.168.57.20","TCP","76","56913  >  7710 [PSH, ACK] Seq=2554 Ack=38760 Win=8326 Len=10 TSval=455510 TSecr=1542846141"
"1816","22.025320442","12:26:58.444085028","192.168.57.30","192.168.57.20","TCP","76","56913  >  7710 [PSH, ACK] Seq=2564 Ack=38882 Win=8326 Len=10 TSval=455519 TSecr=1542846242"
"1823","22.125371152","12:26:58.544135738","192.168.57.30","192.168.57.20","TCP","76","56913  >  7710 [PSH, ACK] Seq=2574 Ack=39003 Win=8326 Len=10 TSval=455528 TSecr=1542846343"
"1836","22.225292883","12:26:58.644057469","192.168.57.30","192.168.57.20","TCP","76","56913  >  7710 [PSH, ACK] Seq=2584 Ack=39123 Win=8326 Len=10 TSval=455536 TSecr=1542846443"
"1843","22.325349209","12:26:58.744113795","192.168.57.30","192.168.57.20","TCP","76","56913  >  7710 [PSH, ACK] Seq=2594 Ack=39240 Win=8326 Len=10 TSval=455546 TSecr=1542846543"
"1852","22.425314700","12:26:58.844079286","192.168.57.30","192.168.57.20","TCP","76","56913  >  7710 [PSH, ACK] Seq=2604 Ack=39361 Win=8326 Len=10 TSval=455555 TSecr=1542846642"
