"No.","Time","AbsTime","Source","Destination","Protocol","Length","Info"
"5","0.027090843","12:26:36.445855429","192.168.57.20","192.168.57.30","TCP","186","7710  >  56913 [PSH, ACK] Seq=1 Ack=11 Win=539 Len=120 TSval=1542824343 TSecr=453538"
"12","0.126792064","12:26:36.545556650","192.168.57.20","192.168.57.30","TCP","183","7710  >  56913 [PSH, ACK] Seq=121 Ack=21 Win=539 Len=117 TSval=1542824436 TSecr=453547"
"21","0.226898529","12:26:36.645663115","192.168.57.20","192.168.57.30","TCP","187","7710  >  56913 [PSH, ACK] Seq=238 Ack=31 Win=539 Len=121 TSval=1542824537 TSecr=453556"
"28","0.326905435","12:26:36.745670021","192.168.57.20","192.168.57.30","TCP","192","7710  >  56913 [PSH, ACK] Seq=359 Ack=41 Win=539 Len=126 TSval=1542824642 TSecr=453566"
"35","0.426882248","12:26:36.845646834","192.168.57.20","192.168.57.30","TCP","187","7710  >  56913 [PSH, ACK] Seq=485 Ack=51 Win=539 Len=121 TSval=1542824738 TSecr=453575"
"42","0.526883842","12:26:36.945648428","192.168.57.20","192.168.57.30","TCP","182","7710  >  56913 [PSH, ACK] Seq=606 Ack=61 Win=539 Len=116 TSval=1542824842 TSecr=453584"
"53","0.626875073","12:26:37.045639659","192.168.57.20","192.168.57.30","TCP","187","7710  >  56913 [PSH, ACK] Seq=1189 Ack=81 Win=539 Len=121 TSval=1542824940 TSecr=453593"
"60","0.726905561","12:26:37.145670147","192.168.57.20","192.168.57.30","TCP","191","7710  >  56913 [PSH, ACK] Seq=1310 Ack=91 Win=539 Len=125 TSval=1542825041 TSecr=453602"
"67","0.826924532","12:26:37.245689118","192.168.57.20","192.168.57.30","TCP","188","7710  >  56913 [PSH, ACK] Seq=1435 Ack=101 Win=539 Len=122 TSval=1542825141 TSecr=453611"
"76","0.926774357","12:26:37.345538943","192.168.57.20","192.168.57.30","TCP","187","7710  >  56913 [PSH, ACK] Seq=1738 Ack=124 Win=539 Len=121 TSval=1542825242 TSecr=453620"
"89","1.027080668","12:26:37.445845254","192.168.57.20","192.168.57.30","TCP","186","7710  >  56913 [PSH, ACK] Seq=1859 Ack=134 Win=538 Len=120 TSval=1542825343 TSecr=453629"
"96","1.126703541","12:26:37.545468127","192.168.57.20","192.168.57.30","TCP","183","7710  >  56913 [PSH, ACK] Seq=1979 Ack=144 Win=538 Len=117 TSval=1542825443 TSecr=453638"
"105","1.226870942","12:26:37.645635528","192.168.57.20","192.168.57.30","TCP","187","7710  >  56913 [PSH, ACK] Seq=2096 Ack=154 Win=538 Len=121 TSval=1542825543 TSecr=453646"
"112","1.326910884","12:26:37.745675470","192.168.57.20","192.168.57.30","TCP","192","7710  >  56913 [PSH, ACK] Seq=2217 Ack=164 Win=538 Len=126 TSval=1542825642 TSecr=453656"
"119","1.426866803","12:26:37.845631389","192.168.57.20","192.168.57.30","TCP","187","7710  >  56913 [PSH, ACK] Seq=2343 Ack=174 Win=538 Len=121 TSval=1542825742 TSecr=453665"
"126","1.526933917","12:26:37.945698503","192.168.57.20","192.168.57.30","TCP","182","7710  >  56913 [PSH, ACK] Seq=2464 Ack=184 Win=538 Len=116 TSval=1542825843 TSecr=453674"
"137","1.626974901","12:26:38.045739487","192.168.57.20","192.168.57.30","TCP","187","7710  >  56913 [PSH, ACK] Seq=3047 Ack=204 Win=538 Len=121 TSval=1542825943 TSecr=453683"
"144","1.726886279","12:26:38.145650865","192.168.57.20","192.168.57.30","TCP","191","7710  >  56913 [PSH, ACK] Seq=3168 Ack=214 Win=538 Len=125 TSval=1542826042 TSecr=453692"
"151","1.826963092","12:26:38.245727678","192.168.57.20","192.168.57.30","TCP","188","7710  >  56913 [PSH, ACK] Seq=3293 Ack=224 Win=538 Len=122 TSval=1542826142 TSecr=453701"
"158","1.926603314","12:26:38.345367900","192.168.57.20","192.168.57.30","TCP","187","7710  >  56913 [PSH, ACK] Seq=3415 Ack=234 Win=538 Len=121 TSval=1542826242 TSecr=453710"
"171","2.027120971","12:26:38.445885557","192.168.57.20","192.168.57.30","TCP","186","7710  >  56913 [PSH, ACK] Seq=3536 Ack=244 Win=538 Len=120 TSval=1542826343 TSecr=453719"
"178","2.126634640","12:26:38.545399226","192.168.57.20","192.168.57.30","TCP","183","7710  >  56913 [PSH, ACK] Seq=3656 Ack=254 Win=538 Len=117 TSval=1542826442 TSecr=453728"
"187","2.226905729","12:26:38.645670315","192.168.57.20","192.168.57.30","TCP","187","7710  >  56913 [PSH, ACK] Seq=3773 Ack=264 Win=538 Len=121 TSval=1542826543 TSecr=453736"
"194","2.326906228","12:26:38.745670814","192.168.57.20","192.168.57.30","TCP","192","7710  >  56913 [PSH, ACK] Seq=3894 Ack=274 Win=538 Len=126 TSval=1542826642 TSecr=453745"
"201","2.426888256","12:26:38.845652842","192.168.57.20","192.168.57.30","TCP","187","7710  >  56913 [PSH, ACK] Seq=4020 Ack=284 Win=538 Len=121 TSval=1542826742 TSecr=453754"
"208","2.526873132","12:26:38.945637718","192.168.57.20","192.168.57.30","TCP","182","7710  >  56913 [PSH, ACK] Seq=4141 Ack=294 Win=538 Len=116 TSval=1542826842 TSecr=453763"
"219","2.626918199","12:26:39.045682785","192.168.57.20","192.168.57.30","TCP","187","7710  >  56913 [PSH, ACK] Seq=4724 Ack=314 Win=538 Len=121 TSval=1542826942 TSecr=453772"
"226","2.726860930","12:26:39.145625516","192.168.57.20","192.168.57.30","TCP","191","7710  >  56913 [PSH, ACK] Seq=4845 Ack=324 Win=538 Len=125 TSval=1542827042 TSecr=453781"
"233","2.826885384","12:26:39.245649970","192.168.57.20","192.168.57.30","TCP","188","7710  >  56913 [PSH, ACK] Seq=4970 Ack=334 Win=538 Len=122 TSval=1542827142 TSecr=453790"
"242","2.926614818","12:26:39.345379404","192.168.57.20","192.168.57.30","TCP","187","7710  >  56913 [PSH, ACK] Seq=5273 Ack=357 Win=538 Len=121 TSval=1542827242 TSecr=453799"
"254","3.027063854","12:26:39.445828440","192.168.57.20","192.168.57.30","TCP","186","7710  >  56913 [PSH, ACK] Seq=5394 Ack=367 Win=538 Len=120 TSval=1542827343 TSecr=453808"
"262","3.126654331","12:26:39.545418917","192.168.57.20","192.168.57.30","TCP","183","7710  >  56913 [PSH, ACK] Seq=5514 Ack=377 Win=538 Len=117 TSval=1542827443 TSecr=453817"
"270","3.226910187","12:26:39.645674773","192.168.57.20","192.168.57.30","TCP","187","7710  >  56913 [PSH, ACK] Seq=5631 Ack=387 Win=538 Len=121 TSval=1542827543 TSecr=453826"
"278","3.326921865","12:26:39.745686451","192.168.57.20","192.168.57.30","TCP","192","7710  >  56913 [PSH, ACK] Seq=5752 Ack=397 Win=537 Len=126 TSval=1542827642 TSecr=453835"
"284","3.426886557","12:26:39.845651143","192.168.57.20","192.168.57.30","TCP","187","7710  >  56913 [PSH, ACK] Seq=5878 Ack=407 Win=537 Len=121 TSval=1542827742 TSecr=453844"
"291","3.526878819","12:26:39.945643405","192.168.57.20","192.168.57.30","TCP","182","7710  >  56913 [PSH, ACK] Seq=5999 Ack=417 Win=537 Len=116 TSval=1542827843 TSecr=453853"
"302","3.626902045","12:26:40.045666631","192.168.57.20","192.168.57.30","TCP","187","7710  >  56913 [PSH, ACK] Seq=6582 Ack=437 Win=537 Len=121 TSval=1542827942 TSecr=453862"
"309","3.726959903","12:26:40.145724489","192.168.57.20","192.168.57.30","TCP","191","7710  >  56913 [PSH, ACK] Seq=6703 Ack=447 Win=537 Len=125 TSval=1542828042 TSecr=453871"
"316","3.826975472","12:26:40.245740058","192.168.57.20","192.168.57.30","TCP","188","7710  >  56913 [PSH, ACK] Seq=6828 Ack=457 Win=537 Len=122 TSval=1542828142 TSecr=453880"
"323","3.926620466","12:26:40.345385052","192.168.57.20","192.168.57.30","TCP","187","7710  >  56913 [PSH, ACK] Seq=6950 Ack=467 Win=537 Len=121 TSval=1542828242 TSecr=453889"
"336","4.027028788","12:26:40.445793374","192.168.57.20","192.168.57.30","TCP","186","7710  >  56913 [PSH, ACK] Seq=7071 Ack=477 Win=537 Len=120 TSval=1542828343 TSecr=453898"
"343","4.126628050","12:26:40.545392636","192.168.57.20","192.168.57.30","TCP","183","7710  >  56913 [PSH, ACK] Seq=7191 Ack=487 Win=537 Len=117 TSval=1542828442 TSecr=453907"
"352","4.226887028","12:26:40.645651614","192.168.57.20","192.168.57.30","TCP","187","7710  >  56913 [PSH, ACK] Seq=7308 Ack=497 Win=537 Len=121 TSval=1542828543 TSecr=453915"
"359","4.326922676","12:26:40.745687262","192.168.57.20","192.168.57.30","TCP","192","7710  >  56913 [PSH, ACK] Seq=7429 Ack=507 Win=537 Len=126 TSval=1542828642 TSecr=453925"
"366","4.426965173","12:26:40.845729759","192.168.57.20","192.168.57.30","TCP","187","7710  >  56913 [PSH, ACK] Seq=7555 Ack=517 Win=537 Len=121 TSval=1542828742 TSecr=453934"
"373","4.526896885","12:26:40.945661471","192.168.57.20","192.168.57.30","TCP","182","7710  >  56913 [PSH, ACK] Seq=7676 Ack=527 Win=537 Len=116 TSval=1542828843 TSecr=453943"
"384","4.626925013","12:26:41.045689599","192.168.57.20","192.168.57.30","TCP","187","7710  >  56913 [PSH, ACK] Seq=8259 Ack=547 Win=537 Len=121 TSval=1542828942 TSecr=453952"
"391","4.726876577","12:26:41.145641163","192.168.57.20","192.168.57.30","TCP","191","7710  >  56913 [PSH, ACK] Seq=8380 Ack=557 Win=543 Len=125 TSval=1542829042 TSecr=453961"
"398","4.826892385","12:26:41.245656971","192.168.57.20","192.168.57.30","TCP","188","7710  >  56913 [PSH, ACK] Seq=8505 Ack=567 Win=542 Len=122 TSval=1542829142 TSecr=453970"
"407","4.926614202","12:26:41.345378788","192.168.57.20","192.168.57.30","TCP","187","7710  >  56913 [PSH, ACK] Seq=8808 Ack=590 Win=542 Len=121 TSval=1542829242 TSecr=453979"
"420","5.026688633","12:26:41.445453219","192.168.57.20","192.168.57.30","TCP","186","7710  >  56913 [PSH, ACK] Seq=8929 Ack=600 Win=542 Len=120 TSval=1542829342 TSecr=453988"
"427","5.126621563","12:26:41.545386149","192.168.57.20","192.168.57.30","TCP","183","7710  >  56913 [PSH, ACK] Seq=9049 Ack=610 Win=542 Len=117 TSval=1542829442 TSecr=453997"
"436","5.226843910","12:26:41.645608496","192.168.57.20","192.168.57.30","TCP","187","7710  >  56913 [PSH, ACK] Seq=9166 Ack=620 Win=542 Len=121 TSval=1542829542 TSecr=454006"
"443","5.326946311","12:26:41.745710897","192.168.57.20","192.168.57.30","TCP","192","7710  >  56913 [PSH, ACK] Seq=9287 Ack=630 Win=542 Len=126 TSval=1542829643 TSecr=454015"
"450","5.426936376","12:26:41.845700962","192.168.57.20","192.168.57.30","TCP","187","7710  >  56913 [PSH, ACK] Seq=9413 Ack=640 Win=542 Len=121 TSval=1542829742 TSecr=454024"
"457","5.526899458","12:26:41.945664044","192.168.57.20","192.168.57.30","TCP","182","7710  >  56913 [PSH, ACK] Seq=9534 Ack=650 Win=542 Len=116 TSval=1542829843 TSecr=454033"
"468","5.626936838","12:26:42.045701424","192.168.57.20","192.168.57.30","TCP","187","7710  >  56913 [PSH, ACK] Seq=10117 Ack=670 Win=542 Len=121 TSval=1542829942 TSecr=454042"
"475","5.726944429","12:26:42.145709015","192.168.57.20","192.168.57.30","TCP","191","7710  >  56913 [PSH, ACK] Seq=10238 Ack=680 Win=542 Len=125 TSval=1542830042 TSecr=454051"
"482","5.826917981","12:26:42.245682567","192.168.57.20","192.168.57.30","TCP","188","7710  >  56913 [PSH, ACK] Seq=10363 Ack=690 Win=542 Len=122 TSval=1542830142 TSecr=454060"
"489","5.926684520","12:26:42.345449106","192.168.57.20","192.168.57.30","TCP","187","7710  >  56913 [PSH, ACK] Seq=10485 Ack=700 Win=542 Len=121 TSval=1542830243 TSecr=454069"
"502","6.027019514","12:26:42.445784100","192.168.57.20","192.168.57.30","TCP","186","7710  >  56913 [PSH, ACK] Seq=10606 Ack=710 Win=542 Len=120 TSval=1542830343 TSecr=454078"
"509","6.126751328","12:26:42.545515914","192.168.57.20","192.168.57.30","TCP","183","7710  >  56913 [PSH, ACK] Seq=10726 Ack=720 Win=542 Len=117 TSval=1542830442 TSecr=454087"
"518","6.226908826","12:26:42.645673412","192.168.57.20","192.168.57.30","TCP","187","7710  >  56913 [PSH, ACK] Seq=10843 Ack=730 Win=542 Len=121 TSval=1542830542 TSecr=454096"
"525","6.326979553","12:26:42.745744139","192.168.57.20","192.168.57.30","TCP","192","7710  >  56913 [PSH, ACK] Seq=10964 Ack=740 Win=542 Len=126 TSval=1542830643 TSecr=454105"
"532","6.426929553","12:26:42.845694139","192.168.57.20","192.168.57.30","TCP","187","7710  >  56913 [PSH, ACK] Seq=11090 Ack=750 Win=542 Len=121 TSval=1542830742 TSecr=454114"
"539","6.526916857","12:26:42.945681443","192.168.57.20","192.168.57.30","TCP","182","7710  >  56913 [PSH, ACK] Seq=11211 Ack=760 Win=542 Len=116 TSval=1542830843 TSecr=454123"
"550","6.626914903","12:26:43.045679489","192.168.57.20","192.168.57.30","TCP","187","7710  >  56913 [PSH, ACK] Seq=11794 Ack=780 Win=542 Len=121 TSval=1542830942 TSecr=454132"
"557","6.726943206","12:26:43.145707792","192.168.57.20","192.168.57.30","TCP","191","7710  >  56913 [PSH, ACK] Seq=11915 Ack=790 Win=542 Len=125 TSval=1542831042 TSecr=454141"
"564","6.826896114","12:26:43.245660700","192.168.57.20","192.168.57.30","TCP","188","7710  >  56913 [PSH, ACK] Seq=12040 Ack=800 Win=542 Len=122 TSval=1542831142 TSecr=454150"
"573","6.926604669","12:26:43.345369255","192.168.57.20","192.168.57.30","TCP","187","7710  >  56913 [PSH, ACK] Seq=12343 Ack=823 Win=541 Len=121 TSval=1542831242 TSecr=454159"
"586","7.026722134","12:26:43.445486720","192.168.57.20","192.168.57.30","TCP","186","7710  >  56913 [PSH, ACK] Seq=12464 Ack=833 Win=541 Len=120 TSval=1542831342 TSecr=454168"
"593","7.126689087","12:26:43.545453673","192.168.57.20","192.168.57.30","TCP","183","7710  >  56913 [PSH, ACK] Seq=12584 Ack=843 Win=541 Len=117 TSval=1542831443 TSecr=454177"
"602","7.226846648","12:26:43.645611234","192.168.57.20","192.168.57.30","TCP","187","7710  >  56913 [PSH, ACK] Seq=12701 Ack=853 Win=541 Len=121 TSval=1542831532 TSecr=454186"
"609","7.326968007","12:26:43.745732593","192.168.57.20","192.168.57.30","TCP","192","7710  >  56913 [PSH, ACK] Seq=12822 Ack=863 Win=541 Len=126 TSval=1542831643 TSecr=454196"
"616","7.426953665","12:26:43.845718251","192.168.57.20","192.168.57.30","TCP","187","7710  >  56913 [PSH, ACK] Seq=12948 Ack=873 Win=541 Len=121 TSval=1542831733 TSecr=454205"
"623","7.526869540","12:26:43.945634126","192.168.57.20","192.168.57.30","TCP","182","7710  >  56913 [PSH, ACK] Seq=13069 Ack=883 Win=541 Len=116 TSval=1542831842 TSecr=454214"
"634","7.626899512","12:26:44.045664098","192.168.57.20","192.168.57.30","TCP","187","7710  >  56913 [PSH, ACK] Seq=13652 Ack=903 Win=541 Len=121 TSval=1542831942 TSecr=454223"
"641","7.726887245","12:26:44.145651831","192.168.57.20","192.168.57.30","TCP","191","7710  >  56913 [PSH, ACK] Seq=13773 Ack=913 Win=541 Len=125 TSval=1542832035 TSecr=454232"
"648","7.826883455","12:26:44.245648041","192.168.57.20","192.168.57.30","TCP","188","7710  >  56913 [PSH, ACK] Seq=13898 Ack=923 Win=541 Len=122 TSval=1542832142 TSecr=454241"
"655","7.926617747","12:26:44.345382333","192.168.57.20","192.168.57.30","TCP","187","7710  >  56913 [PSH, ACK] Seq=14020 Ack=933 Win=541 Len=121 TSval=1542832237 TSecr=454250"
"667","8.026786119","12:26:44.445550705","192.168.57.20","192.168.57.30","TCP","186","7710  >  56913 [PSH, ACK] Seq=14141 Ack=943 Win=541 Len=120 TSval=1542832342 TSecr=454259"
"675","8.126624318","12:26:44.545388904","192.168.57.20","192.168.57.30","TCP","183","7710  >  56913 [PSH, ACK] Seq=14261 Ack=953 Win=541 Len=117 TSval=1542832438 TSecr=454268"
"684","8.226841521","12:26:44.645606107","192.168.57.20","192.168.57.30","TCP","187","7710  >  56913 [PSH, ACK] Seq=14378 Ack=963 Win=541 Len=121 TSval=1542832539 TSecr=454277"
"691","8.326900559","12:26:44.745665145","192.168.57.20","192.168.57.30","TCP","192","7710  >  56913 [PSH, ACK] Seq=14499 Ack=973 Win=541 Len=126 TSval=1542832640 TSecr=454286"
"698","8.426927848","12:26:44.845692434","192.168.57.20","192.168.57.30","TCP","187","7710  >  56913 [PSH, ACK] Seq=14625 Ack=983 Win=541 Len=121 TSval=1542832740 TSecr=454295"
"705","8.526882761","12:26:44.945647347","192.168.57.20","192.168.57.30","TCP","182","7710  >  56913 [PSH, ACK] Seq=14746 Ack=993 Win=541 Len=116 TSval=1542832842 TSecr=454304"
"716","8.626905363","12:26:45.045669949","192.168.57.20","192.168.57.30","TCP","187","7710  >  56913 [PSH, ACK] Seq=15329 Ack=1013 Win=541 Len=121 TSval=1542832942 TSecr=454313"
"722","8.726894764","12:26:45.145659350","192.168.57.20","192.168.57.30","TCP","191","7710  >  56913 [PSH, ACK] Seq=15450 Ack=1023 Win=541 Len=125 TSval=1542833042 TSecr=454322"
"729","8.826858291","12:26:45.245622877","192.168.57.20","192.168.57.30","TCP","188","7710  >  56913 [PSH, ACK] Seq=15575 Ack=1033 Win=541 Len=122 TSval=1542833142 TSecr=454331"
"737","8.926781096","12:26:45.345545682","192.168.57.20","192.168.57.30","TCP","187","7710  >  56913 [PSH, ACK] Seq=15878 Ack=1056 Win=541 Len=121 TSval=1542833242 TSecr=454340"
"744","9.026946508","12:26:45.445711094","192.168.57.20","192.168.57.30","TCP","186","7710  >  56913 [PSH, ACK] Seq=15999 Ack=1066 Win=541 Len=120 TSval=1542833343 TSecr=454349"
"757","9.127012376","12:26:45.545776962","192.168.57.20","192.168.57.30","TCP","183","7710  >  56913 [PSH, ACK] Seq=16119 Ack=1076 Win=540 Len=117 TSval=1542833443 TSecr=454358"
"764","9.226857888","12:26:45.645622474","192.168.57.20","192.168.57.30","TCP","187","7710  >  56913 [PSH, ACK] Seq=16236 Ack=1086 Win=540 Len=121 TSval=1542833542 TSecr=454367"
"773","9.326986370","12:26:45.745750956","192.168.57.20","192.168.57.30","TCP","192","7710  >  56913 [PSH, ACK] Seq=16357 Ack=1096 Win=540 Len=126 TSval=1542833642 TSecr=454376"
"780","9.426938587","12:26:45.845703173","192.168.57.20","192.168.57.30","TCP","187","7710  >  56913 [PSH, ACK] Seq=16483 Ack=1106 Win=540 Len=121 TSval=1542833742 TSecr=454385"
"787","9.526891717","12:26:45.945656303","192.168.57.20","192.168.57.30","TCP","182","7710  >  56913 [PSH, ACK] Seq=16604 Ack=1116 Win=540 Len=116 TSval=1542833843 TSecr=454394"
"798","9.626898755","12:26:46.045663341","192.168.57.20","192.168.57.30","TCP","187","7710  >  56913 [PSH, ACK] Seq=17187 Ack=1136 Win=540 Len=121 TSval=1542833942 TSecr=454403"
"805","9.726893010","12:26:46.145657596","192.168.57.20","192.168.57.30","TCP","191","7710  >  56913 [PSH, ACK] Seq=17308 Ack=1146 Win=540 Len=125 TSval=1542834042 TSecr=454412"
"812","9.826905281","12:26:46.245669867","192.168.57.20","192.168.57.30","TCP","188","7710  >  56913 [PSH, ACK] Seq=17433 Ack=1156 Win=540 Len=122 TSval=1542834142 TSecr=454421"
"819","9.926638758","12:26:46.345403344","192.168.57.20","192.168.57.30","TCP","187","7710  >  56913 [PSH, ACK] Seq=17555 Ack=1166 Win=540 Len=121 TSval=1542834242 TSecr=454430"
"826","10.027149348","12:26:46.445913934","192.168.57.20","192.168.57.30","TCP","186","7710  >  56913 [PSH, ACK] Seq=17676 Ack=1176 Win=540 Len=120 TSval=1542834343 TSecr=454439"
"839","10.126634938","12:26:46.545399524","192.168.57.20","192.168.57.30","TCP","183","7710  >  56913 [PSH, ACK] Seq=17796 Ack=1186 Win=540 Len=117 TSval=1542834442 TSecr=454448"
"846","10.226868848","12:26:46.645633434","192.168.57.20","192.168.57.30","TCP","187","7710  >  56913 [PSH, ACK] Seq=17913 Ack=1196 Win=540 Len=121 TSval=1542834542 TSecr=454457"
"855","10.326889745","12:26:46.745654331","192.168.57.20","192.168.57.30","TCP","192","7710  >  56913 [PSH, ACK] Seq=18034 Ack=1206 Win=540 Len=126 TSval=1542834642 TSecr=454466"
"862","10.426920793","12:26:46.845685379","192.168.57.20","192.168.57.30","TCP","187","7710  >  56913 [PSH, ACK] Seq=18160 Ack=1216 Win=540 Len=121 TSval=1542834742 TSecr=454475"
"869","10.526853789","12:26:46.945618375","192.168.57.20","192.168.57.30","TCP","182","7710  >  56913 [PSH, ACK] Seq=18281 Ack=1226 Win=540 Len=116 TSval=1542834842 TSecr=454484"
"880","10.626919510","12:26:47.045684096","192.168.57.20","192.168.57.30","TCP","187","7710  >  56913 [PSH, ACK] Seq=18864 Ack=1246 Win=540 Len=121 TSval=1542834942 TSecr=454493"
"887","10.726873371","12:26:47.145637957","192.168.57.20","192.168.57.30","TCP","191","7710  >  56913 [PSH, ACK] Seq=18985 Ack=1256 Win=540 Len=125 TSval=1542835042 TSecr=454502"
"894","10.826890613","12:26:47.245655199","192.168.57.20","192.168.57.30","TCP","188","7710  >  56913 [PSH, ACK] Seq=19110 Ack=1266 Win=540 Len=122 TSval=1542835142 TSecr=454511"
"903","10.926761645","12:26:47.345526231","192.168.57.20","192.168.57.30","TCP","187","7710  >  56913 [PSH, ACK] Seq=19413 Ack=1289 Win=540 Len=121 TSval=1542835243 TSecr=454520"
"910","11.027416046","12:26:47.446180632","192.168.57.20","192.168.57.30","TCP","186","7710  >  56913 [PSH, ACK] Seq=19534 Ack=1299 Win=540 Len=120 TSval=1542835343 TSecr=454529"
"923","11.126666574","12:26:47.545431160","192.168.57.20","192.168.57.30","TCP","183","7710  >  56913 [PSH, ACK] Seq=19654 Ack=1309 Win=540 Len=117 TSval=1542835442 TSecr=454538"
"930","11.226824345","12:26:47.645588931","192.168.57.20","192.168.57.30","TCP","187","7710  >  56913 [PSH, ACK] Seq=19771 Ack=1319 Win=540 Len=121 TSval=1542835542 TSecr=454547"
"939","11.326914284","12:26:47.745678870","192.168.57.20","192.168.57.30","TCP","192","7710  >  56913 [PSH, ACK] Seq=19892 Ack=1329 Win=539 Len=126 TSval=1542835642 TSecr=454556"
"946","11.426951864","12:26:47.845716450","192.168.57.20","192.168.57.30","TCP","187","7710  >  56913 [PSH, ACK] Seq=20018 Ack=1339 Win=539 Len=121 TSval=1542835742 TSecr=454565"
"953","11.526938508","12:26:47.945703094","192.168.57.20","192.168.57.30","TCP","182","7710  >  56913 [PSH, ACK] Seq=20139 Ack=1349 Win=539 Len=116 TSval=1542835843 TSecr=454574"
"964","11.626891386","12:26:48.045655972","192.168.57.20","192.168.57.30","TCP","187","7710  >  56913 [PSH, ACK] Seq=20722 Ack=1369 Win=539 Len=121 TSval=1542835942 TSecr=454583"
"971","11.726871876","12:26:48.145636462","192.168.57.20","192.168.57.30","TCP","191","7710  >  56913 [PSH, ACK] Seq=20843 Ack=1379 Win=539 Len=125 TSval=1542836033 TSecr=454592"
"978","11.826902169","12:26:48.245666755","192.168.57.20","192.168.57.30","TCP","188","7710  >  56913 [PSH, ACK] Seq=20968 Ack=1389 Win=539 Len=122 TSval=1542836142 TSecr=454601"
"985","11.926601034","12:26:48.345365620","192.168.57.20","192.168.57.30","TCP","187","7710  >  56913 [PSH, ACK] Seq=21090 Ack=1399 Win=539 Len=121 TSval=1542836235 TSecr=454610"
"992","12.026727274","12:26:48.445491860","192.168.57.20","192.168.57.30","TCP","186","7710  >  56913 [PSH, ACK] Seq=21211 Ack=1409 Win=539 Len=120 TSval=1542836342 TSecr=454619"
"1005","12.126913416","12:26:48.545678002","192.168.57.20","192.168.57.30","TCP","183","7710  >  56913 [PSH, ACK] Seq=21331 Ack=1419 Win=539 Len=117 TSval=1542836437 TSecr=454628"
"1012","12.226837469","12:26:48.645602055","192.168.57.20","192.168.57.30","TCP","187","7710  >  56913 [PSH, ACK] Seq=21448 Ack=1429 Win=539 Len=121 TSval=1542836537 TSecr=454636"
"1021","12.326896845","12:26:48.745661431","192.168.57.20","192.168.57.30","TCP","192","7710  >  56913 [PSH, ACK] Seq=21569 Ack=1439 Win=539 Len=126 TSval=1542836642 TSecr=454646"
"1028","12.426874714","12:26:48.845639300","192.168.57.20","192.168.57.30","TCP","187","7710  >  56913 [PSH, ACK] Seq=21695 Ack=1449 Win=539 Len=121 TSval=1542836738 TSecr=454655"
"1035","12.526949498","12:26:48.945714084","192.168.57.20","192.168.57.30","TCP","182","7710  >  56913 [PSH, ACK] Seq=21816 Ack=1459 Win=539 Len=116 TSval=1542836843 TSecr=454664"
"1046","12.626921475","12:26:49.045686061","192.168.57.20","192.168.57.30","TCP","187","7710  >  56913 [PSH, ACK] Seq=22399 Ack=1479 Win=539 Len=121 TSval=1542836940 TSecr=454673"
"1053","12.726879183","12:26:49.145643769","192.168.57.20","192.168.57.30","TCP","191","7710  >  56913 [PSH, ACK] Seq=22520 Ack=1489 Win=539 Len=125 TSval=1542837040 TSecr=454682"
"1060","12.826900982","12:26:49.245665568","192.168.57.20","192.168.57.30","TCP","188","7710  >  56913 [PSH, ACK] Seq=22645 Ack=1499 Win=539 Len=122 TSval=1542837141 TSecr=454691"
"1069","12.926621075","12:26:49.345385661","192.168.57.20","192.168.57.30","TCP","187","7710  >  56913 [PSH, ACK] Seq=22948 Ack=1522 Win=539 Len=121 TSval=1542837242 TSecr=454700"
"1076","13.029623807","12:26:49.448388393","192.168.57.20","192.168.57.30","TCP","186","7710  >  56913 [PSH, ACK] Seq=23069 Ack=1532 Win=539 Len=120 TSval=1542837345 TSecr=454709"
"1089","13.126633626","12:26:49.545398212","192.168.57.20","192.168.57.30","TCP","183","7710  >  56913 [PSH, ACK] Seq=23189 Ack=1542 Win=539 Len=117 TSval=1542837442 TSecr=454718"
"1096","13.226840801","12:26:49.645605387","192.168.57.20","192.168.57.30","TCP","187","7710  >  56913 [PSH, ACK] Seq=23306 Ack=1552 Win=539 Len=121 TSval=1542837543 TSecr=454727"
"1105","13.326925210","12:26:49.745689796","192.168.57.20","192.168.57.30","TCP","192","7710  >  56913 [PSH, ACK] Seq=23427 Ack=1562 Win=539 Len=126 TSval=1542837639 TSecr=454736"
"1112","13.426891628","12:26:49.845656214","192.168.57.20","192.168.57.30","TCP","187","7710  >  56913 [PSH, ACK] Seq=23553 Ack=1572 Win=539 Len=121 TSval=1542837742 TSecr=454745"
"1119","13.526938315","12:26:49.945702901","192.168.57.20","192.168.57.30","TCP","182","7710  >  56913 [PSH, ACK] Seq=23674 Ack=1582 Win=538 Len=116 TSval=1542837842 TSecr=454754"
"1130","13.627335733","12:26:50.046100319","192.168.57.20","192.168.57.30","TCP","187","7710  >  56913 [PSH, ACK] Seq=24257 Ack=1602 Win=538 Len=121 TSval=1542837936 TSecr=454763"
"1137","13.726874493","12:26:50.145639079","192.168.57.20","192.168.57.30","TCP","191","7710  >  56913 [PSH, ACK] Seq=24378 Ack=1612 Win=538 Len=125 TSval=1542838042 TSecr=454772"
"1144","13.826909353","12:26:50.245673939","192.168.57.20","192.168.57.30","TCP","188","7710  >  56913 [PSH, ACK] Seq=24503 Ack=1622 Win=538 Len=122 TSval=1542838142 TSecr=454781"
"1151","13.926673348","12:26:50.345437934","192.168.57.20","192.168.57.30","TCP","187","7710  >  56913 [PSH, ACK] Seq=24625 Ack=1632 Win=538 Len=121 TSval=1542838233 TSecr=454790"
"1158","14.027128558","12:26:50.445893144","192.168.57.20","192.168.57.30","TCP","186","7710  >  56913 [PSH, ACK] Seq=24746 Ack=1642 Win=538 Len=120 TSval=1542838342 TSecr=454799"
"1171","14.126923547","12:26:50.545688133","192.168.57.20","192.168.57.30","TCP","183","7710  >  56913 [PSH, ACK] Seq=24866 Ack=1652 Win=538 Len=117 TSval=1542838443 TSecr=454808"
"1178","14.226858742","12:26:50.645623328","192.168.57.20","192.168.57.30","TCP","187","7710  >  56913 [PSH, ACK] Seq=24983 Ack=1662 Win=538 Len=121 TSval=1542838542 TSecr=454817"
"1187","14.326899503","12:26:50.745664089","192.168.57.20","192.168.57.30","TCP","192","7710  >  56913 [PSH, ACK] Seq=25104 Ack=1672 Win=538 Len=126 TSval=1542838642 TSecr=454826"
"1194","14.426892680","12:26:50.845657266","192.168.57.20","192.168.57.30","TCP","187","7710  >  56913 [PSH, ACK] Seq=25230 Ack=1682 Win=538 Len=121 TSval=1542838742 TSecr=454835"
"1201","14.526885534","12:26:50.945650120","192.168.57.20","192.168.57.30","TCP","182","7710  >  56913 [PSH, ACK] Seq=25351 Ack=1692 Win=538 Len=116 TSval=1542838842 TSecr=454844"
"1212","14.626935284","12:26:51.045699870","192.168.57.20","192.168.57.30","TCP","187","7710  >  56913 [PSH, ACK] Seq=25934 Ack=1712 Win=538 Len=121 TSval=1542838942 TSecr=454853"
"1219","14.726906025","12:26:51.145670611","192.168.57.20","192.168.57.30","TCP","191","7710  >  56913 [PSH, ACK] Seq=26055 Ack=1722 Win=538 Len=125 TSval=1542839042 TSecr=454862"
"1226","14.826895529","12:26:51.245660115","192.168.57.20","192.168.57.30","TCP","188","7710  >  56913 [PSH, ACK] Seq=26180 Ack=1732 Win=538 Len=122 TSval=1542839142 TSecr=454871"
"1235","14.926626303","12:26:51.345390889","192.168.57.20","192.168.57.30","TCP","187","7710  >  56913 [PSH, ACK] Seq=26483 Ack=1755 Win=538 Len=121 TSval=1542839242 TSecr=454880"
"1242","15.027063784","12:26:51.445828370","192.168.57.20","192.168.57.30","TCP","186","7710  >  56913 [PSH, ACK] Seq=26604 Ack=1765 Win=538 Len=120 TSval=1542839342 TSecr=454889"
"1255","15.126626030","12:26:51.545390616","192.168.57.20","192.168.57.30","TCP","183","7710  >  56913 [PSH, ACK] Seq=26724 Ack=1775 Win=538 Len=117 TSval=1542839442 TSecr=454898"
"1262","15.226904871","12:26:51.645669457","192.168.57.20","192.168.57.30","TCP","187","7710  >  56913 [PSH, ACK] Seq=26841 Ack=1785 Win=538 Len=121 TSval=1542839542 TSecr=454907"
"1271","15.326894917","12:26:51.745659503","192.168.57.20","192.168.57.30","TCP","192","7710  >  56913 [PSH, ACK] Seq=26962 Ack=1795 Win=538 Len=126 TSval=1542839642 TSecr=454916"
"1278","15.426868559","12:26:51.845633145","192.168.57.20","192.168.57.30","TCP","187","7710  >  56913 [PSH, ACK] Seq=27088 Ack=1805 Win=538 Len=121 TSval=1542839742 TSecr=454925"
"1285","15.526986804","12:26:51.945751390","192.168.57.20","192.168.57.30","TCP","182","7710  >  56913 [PSH, ACK] Seq=27209 Ack=1815 Win=538 Len=116 TSval=1542839842 TSecr=454934"
"1296","15.626945800","12:26:52.045710386","192.168.57.20","192.168.57.30","TCP","187","7710  >  56913 [PSH, ACK] Seq=27792 Ack=1835 Win=538 Len=121 TSval=1542839942 TSecr=454943"
"1303","15.726889686","12:26:52.145654272","192.168.57.20","192.168.57.30","TCP","191","7710  >  56913 [PSH, ACK] Seq=27913 Ack=1845 Win=537 Len=125 TSval=1542840042 TSecr=454952"
"1310","15.826877921","12:26:52.245642507","192.168.57.20","192.168.57.30","TCP","188","7710  >  56913 [PSH, ACK] Seq=28038 Ack=1855 Win=537 Len=122 TSval=1542840142 TSecr=454961"
"1317","15.926725060","12:26:52.345489646","192.168.57.20","192.168.57.30","TCP","187","7710  >  56913 [PSH, ACK] Seq=28160 Ack=1865 Win=537 Len=121 TSval=1542840243 TSecr=454970"
"1324","16.027912916","12:26:52.446677502","192.168.57.20","192.168.57.30","TCP","186","7710  >  56913 [PSH, ACK] Seq=28281 Ack=1875 Win=537 Len=120 TSval=1542840343 TSecr=454979"
"1336","16.126624873","12:26:52.545389459","192.168.57.20","192.168.57.30","TCP","183","7710  >  56913 [PSH, ACK] Seq=28401 Ack=1885 Win=537 Len=117 TSval=1542840442 TSecr=454988"
"1344","16.226859736","12:26:52.645624322","192.168.57.20","192.168.57.30","TCP","187","7710  >  56913 [PSH, ACK] Seq=28518 Ack=1895 Win=537 Len=121 TSval=1542840542 TSecr=454997"
"1352","16.326909872","12:26:52.745674458","192.168.57.20","192.168.57.30","TCP","192","7710  >  56913 [PSH, ACK] Seq=28639 Ack=1905 Win=537 Len=126 TSval=1542840642 TSecr=455006"
"1360","16.426877942","12:26:52.845642528","192.168.57.20","192.168.57.30","TCP","187","7710  >  56913 [PSH, ACK] Seq=28765 Ack=1915 Win=537 Len=121 TSval=1542840742 TSecr=455015"
"1367","16.526924975","12:26:52.945689561","192.168.57.20","192.168.57.30","TCP","182","7710  >  56913 [PSH, ACK] Seq=28886 Ack=1925 Win=537 Len=116 TSval=1542840842 TSecr=455024"
"1377","16.626900041","12:26:53.045664627","192.168.57.20","192.168.57.30","TCP","187","7710  >  56913 [PSH, ACK] Seq=29469 Ack=1945 Win=537 Len=121 TSval=1542840942 TSecr=455033"
"1384","16.726903107","12:26:53.145667693","192.168.57.20","192.168.57.30","TCP","191","7710  >  56913 [PSH, ACK] Seq=29590 Ack=1955 Win=537 Len=125 TSval=1542841042 TSecr=455042"
"1391","16.826893186","12:26:53.245657772","192.168.57.20","192.168.57.30","TCP","188","7710  >  56913 [PSH, ACK] Seq=29715 Ack=1965 Win=537 Len=122 TSval=1542841142 TSecr=455051"
"1400","16.926621750","12:26:53.345386336","192.168.57.20","192.168.57.30","TCP","187","7710  >  56913 [PSH, ACK] Seq=30018 Ack=1988 Win=537 Len=121 TSval=1542841242 TSecr=455060"
"1407","17.027056460","12:26:53.445821046","192.168.57.20","192.168.57.30","TCP","186","7710  >  56913 [PSH, ACK] Seq=30139 Ack=1998 Win=537 Len=120 TSval=1542841342 TSecr=455069"
"1420","17.126631940","12:26:53.545396526","192.168.57.20","192.168.57.30","TCP","183","7710  >  56913 [PSH, ACK] Seq=30259 Ack=2008 Win=543 Len=117 TSval=1542841442 TSecr=455078"
"1427","17.226863296","12:26:53.645627882","192.168.57.20","192.168.57.30","TCP","187","7710  >  56913 [PSH, ACK] Seq=30376 Ack=2018 Win=542 Len=121 TSval=1542841542 TSecr=455086"
"1436","17.326905037","12:26:53.745669623","192.168.57.20","192.168.57.30","TCP","192","7710  >  56913 [PSH, ACK] Seq=30497 Ack=2028 Win=542 Len=126 TSval=1542841642 TSecr=455096"
"1443","17.426876585","12:26:53.845641171","192.168.57.20","192.168.57.30","TCP","187","7710  >  56913 [PSH, ACK] Seq=30623 Ack=2038 Win=542 Len=121 TSval=1542841742 TSecr=455105"
"1450","17.526855479","12:26:53.945620065","192.168.57.20","192.168.57.30","TCP","182","7710  >  56913 [PSH, ACK] Seq=30744 Ack=2048 Win=542 Len=116 TSval=1542841842 TSecr=455114"
"1461","17.626901781","12:26:54.045666367","192.168.57.20","192.168.57.30","TCP","187","7710  >  56913 [PSH, ACK] Seq=31327 Ack=2068 Win=542 Len=121 TSval=1542841942 TSecr=455123"
"1468","17.727020247","12:26:54.145784833","192.168.57.20","192.168.57.30","TCP","191","7710  >  56913 [PSH, ACK] Seq=31448 Ack=2078 Win=542 Len=125 TSval=1542842043 TSecr=455132"
"1475","17.826865998","12:26:54.245630584","192.168.57.20","192.168.57.30","TCP","188","7710  >  56913 [PSH, ACK] Seq=31573 Ack=2088 Win=542 Len=122 TSval=1542842142 TSecr=455141"
"1482","17.926658727","12:26:54.345423313","192.168.57.20","192.168.57.30","TCP","187","7710  >  56913 [PSH, ACK] Seq=31695 Ack=2098 Win=542 Len=121 TSval=1542842242 TSecr=455150"
"1489","18.027076808","12:26:54.445841394","192.168.57.20","192.168.57.30","TCP","186","7710  >  56913 [PSH, ACK] Seq=31816 Ack=2108 Win=542 Len=120 TSval=1542842342 TSecr=455159"
"1502","18.126998142","12:26:54.545762728","192.168.57.20","192.168.57.30","TCP","183","7710  >  56913 [PSH, ACK] Seq=31936 Ack=2118 Win=542 Len=117 TSval=1542842443 TSecr=455168"
"1509","18.226847839","12:26:54.645612425","192.168.57.20","192.168.57.30","TCP","187","7710  >  56913 [PSH, ACK] Seq=32053 Ack=2128 Win=542 Len=121 TSval=1542842542 TSecr=455177"
"1518","18.326909019","12:26:54.745673605","192.168.57.20","192.168.57.30","TCP","192","7710  >  56913 [PSH, ACK] Seq=32174 Ack=2138 Win=542 Len=126 TSval=1542842642 TSecr=455186"
"1525","18.426865366","12:26:54.845629952","192.168.57.20","192.168.57.30","TCP","187","7710  >  56913 [PSH, ACK] Seq=32300 Ack=2148 Win=542 Len=121 TSval=1542842742 TSecr=455195"
"1532","18.526911711","12:26:54.945676297","192.168.57.20","192.168.57.30","TCP","182","7710  >  56913 [PSH, ACK] Seq=32421 Ack=2158 Win=542 Len=116 TSval=1542842842 TSecr=455204"
"1543","18.626903010","12:26:55.045667596","192.168.57.20","192.168.57.30","TCP","187","7710  >  56913 [PSH, ACK] Seq=33004 Ack=2178 Win=542 Len=121 TSval=1542842942 TSecr=455212"
"1550","18.726942993","12:26:55.145707579","192.168.57.20","192.168.57.30","TCP","191","7710  >  56913 [PSH, ACK] Seq=33125 Ack=2188 Win=542 Len=125 TSval=1542843042 TSecr=455222"
"1557","18.826897945","12:26:55.245662531","192.168.57.20","192.168.57.30","TCP","188","7710  >  56913 [PSH, ACK] Seq=33250 Ack=2198 Win=542 Len=122 TSval=1542843142 TSecr=455231"
"1566","18.926583837","12:26:55.345348423","192.168.57.20","192.168.57.30","TCP","187","7710  >  56913 [PSH, ACK] Seq=33553 Ack=2221 Win=542 Len=121 TSval=1542843242 TSecr=455240"
"1573","19.027039252","12:26:55.445803838","192.168.57.20","192.168.57.30","TCP","186","7710  >  56913 [PSH, ACK] Seq=33674 Ack=2231 Win=542 Len=120 TSval=1542843342 TSecr=455249"
"1586","19.126605393","12:26:55.545369979","192.168.57.20","192.168.57.30","TCP","183","7710  >  56913 [PSH, ACK] Seq=33794 Ack=2241 Win=542 Len=117 TSval=1542843442 TSecr=455258"
"1593","19.226817246","12:26:55.645581832","192.168.57.20","192.168.57.30","TCP","183","7710  >  56913 [PSH, ACK] Seq=33911 Ack=2251 Win=542 Len=117 TSval=1542843542 TSecr=455267"
"1602","19.326864639","12:26:55.745629225","192.168.57.20","192.168.57.30","TCP","187","7710  >  56913 [PSH, ACK] Seq=34028 Ack=2261 Win=542 Len=121 TSval=1542843642 TSecr=455276"
"1609","19.426882607","12:26:55.845647193","192.168.57.20","192.168.57.30","TCP","192","7710  >  56913 [PSH, ACK] Seq=34149 Ack=2271 Win=541 Len=126 TSval=1542843742 TSecr=455285"
"1616","19.527661037","12:26:55.946425623","192.168.57.20","192.168.57.30","TCP","187","7710  >  56913 [PSH, ACK] Seq=34275 Ack=2281 Win=541 Len=121 TSval=1542843843 TSecr=455294"
"1627","19.626888157","12:26:56.045652743","192.168.57.20","192.168.57.30","TCP","182","7710  >  56913 [PSH, ACK] Seq=34863 Ack=2301 Win=541 Len=116 TSval=1542843942 TSecr=455303"
"1634","19.726863337","12:26:56.145627923","192.168.57.20","192.168.57.30","TCP","187","7710  >  56913 [PSH, ACK] Seq=34979 Ack=2311 Win=541 Len=121 TSval=1542844042 TSecr=455312"
"1641","19.826904311","12:26:56.245668897","192.168.57.20","192.168.57.30","TCP","191","7710  >  56913 [PSH, ACK] Seq=35100 Ack=2321 Win=541 Len=125 TSval=1542844142 TSecr=455321"
"1648","19.926586225","12:26:56.345350811","192.168.57.20","192.168.57.30","TCP","188","7710  >  56913 [PSH, ACK] Seq=35225 Ack=2331 Win=541 Len=122 TSval=1542844242 TSecr=455330"
"1655","20.026734326","12:26:56.445498912","192.168.57.20","192.168.57.30","TCP","187","7710  >  56913 [PSH, ACK] Seq=35347 Ack=2341 Win=541 Len=121 TSval=1542844328 TSecr=455339"
"1668","20.126694221","12:26:56.545458807","192.168.57.20","192.168.57.30","TCP","186","7710  >  56913 [PSH, ACK] Seq=35468 Ack=2351 Win=541 Len=120 TSval=1542844442 TSecr=455348"
"1675","20.226826556","12:26:56.645591142","192.168.57.20","192.168.57.30","TCP","183","7710  >  56913 [PSH, ACK] Seq=35588 Ack=2361 Win=541 Len=117 TSval=1542844542 TSecr=455357"
"1684","20.326856954","12:26:56.745621540","192.168.57.20","192.168.57.30","TCP","187","7710  >  56913 [PSH, ACK] Seq=35705 Ack=2371 Win=541 Len=121 TSval=1542844642 TSecr=455366"
"1691","20.426869122","12:26:56.845633708","192.168.57.20","192.168.57.30","TCP","192","7710  >  56913 [PSH, ACK] Seq=35826 Ack=2381 Win=541 Len=126 TSval=1542844742 TSecr=455375"
"1698","20.526853011","12:26:56.945617597","192.168.57.20","192.168.57.30","TCP","187","7710  >  56913 [PSH, ACK] Seq=35952 Ack=2391 Win=541 Len=121 TSval=1542844832 TSecr=455384"
"1709","20.626870105","12:26:57.045634691","192.168.57.20","192.168.57.30","TCP","182","7710  >  56913 [PSH, ACK] Seq=36540 Ack=2411 Win=541 Len=116 TSval=1542844942 TSecr=455393"
"1716","20.726866826","12:26:57.145631412","192.168.57.20","192.168.57.30","TCP","187","7710  >  56913 [PSH, ACK] Seq=36656 Ack=2421 Win=541 Len=121 TSval=1542845033 TSecr=455402"
"1723","20.826954893","12:26:57.245719479","192.168.57.20","192.168.57.30","TCP","191","7710  >  56913 [PSH, ACK] Seq=36777 Ack=2431 Win=541 Len=125 TSval=1542845142 TSecr=455411"
"1732","20.927200646","12:26:57.345965232","192.168.57.20","192.168.57.30","TCP","188","7710  >  56913 [PSH, ACK] Seq=37083 Ack=2454 Win=541 Len=122 TSval=1542845235 TSecr=455420"
"1739","21.027482001","12:26:57.446246587","192.168.57.20","192.168.57.30","TCP","187","7710  >  56913 [PSH, ACK] Seq=37205 Ack=2464 Win=541 Len=121 TSval=1542845343 TSecr=455429"
"1752","21.126735178","12:26:57.545499764","192.168.57.20","192.168.57.30","TCP","186","7710  >  56913 [PSH, ACK] Seq=37326 Ack=2474 Win=541 Len=120 TSval=1542845442 TSecr=455438"
"1759","21.226828311","12:26:57.645592897","192.168.57.20","192.168.57.30","TCP","183","7710  >  56913 [PSH, ACK] Seq=37446 Ack=2484 Win=541 Len=117 TSval=1542845537 TSecr=455447"
"1768","21.326812984","12:26:57.745577570","192.168.57.20","192.168.57.30","TCP","187","7710  >  56913 [PSH, ACK] Seq=37563 Ack=2494 Win=541 Len=121 TSval=1542845642 TSecr=455456"
"1775","21.426930020","12:26:57.845694606","192.168.57.20","192.168.57.30","TCP","192","7710  >  56913 [PSH, ACK] Seq=37684 Ack=2504 Win=541 Len=126 TSval=1542845739 TSecr=455465"
"1782","21.526887544","12:26:57.945652130","192.168.57.20","192.168.57.30","TCP","187","7710  >  56913 [PSH, ACK] Seq=37810 Ack=2514 Win=541 Len=121 TSval=1542845839 TSecr=455474"
"1793","21.626874513","12:26:58.045639099","192.168.57.20","192.168.57.30","TCP","182","7710  >  56913 [PSH, ACK] Seq=38398 Ack=2534 Win=540 Len=116 TSval=1542845940 TSecr=455483"
"1800","21.726862676","12:26:58.145627262","192.168.57.20","192.168.57.30","TCP","187","7710  >  56913 [PSH, ACK] Seq=38514 Ack=2544 Win=540 Len=121 TSval=1542846041 TSecr=455492"
"1806","21.826337862","12:26:58.245102448","192.168.57.20","192.168.57.30","TCP","191","7710  >  56913 [PSH, ACK] Seq=38635 Ack=2554 Win=540 Len=125 TSval=1542846141 TSecr=455501"
"1814","21.927212680","12:26:58.345977266","192.168.57.20","192.168.57.30","TCP","188","7710  >  56913 [PSH, ACK] Seq=38760 Ack=2564 Win=540 Len=122 TSval=1542846242 TSecr=455510"
"1820","22.026885728","12:26:58.445650314","192.168.57.20","192.168.57.30","TCP","187","7710  >  56913 [PSH, ACK] Seq=38882 Ack=2574 Win=540 Len=121 TSval=1542846343 TSecr=455519"
"1827","22.127416734","12:26:58.546181320","192.168.57.20","192.168.57.30","TCP","186","7710  >  56913 [PSH, ACK] Seq=39003 Ack=2584 Win=540 Len=120 TSval=1542846443 TSecr=455528"
"1839","22.226773780","12:26:58.645538366","192.168.57.20","192.168.57.30","TCP","183","7710  >  56913 [PSH, ACK] Seq=39123 Ack=2594 Win=540 Len=117 TSval=1542846543 TSecr=455536"
